[
  {
    "asset_type": "HSDC",
    "name": "Cisco 2950 Series switch",
    "quantity": 5,
    "branch_id": 1,
    "location": "Cyber Tower",
    "serial_number": "FOC0630Z0VE, 24",
    "ams_barcode": "RTRTCS0001",
    "po_number": "19",
    "po_date": "2002-06-03",
    "invoice_date": "2002-09-02",
    "purchase_value": 64000.0,
    "current_status": "Working",
    "remarks": null,
    "supplier_name": "Wipro Infotech"
  },
  {
    "asset_type": "HSDC",
    "name": "Cisco 3750 catalyst switch",
    "quantity": 4,
    "branch_id": 1,
    "location": "Cyber Tower",
    "serial_number": "CAT0949N4XL",
    "ams_barcode": "RTRTCS0006",
    "po_number": "47",
    "po_date": "2005-09-19",
    "invoice_date": null,
    "purchase_value": 180000.0,
    "current_status": "Working",
    "remarks": null,
    "supplier_name": "Wipro Infotech"
  },
  {
    "asset_type": "HSDC",
    "name": "Cisco catalyst 2960",
    "quantity": 4,
    "branch_id": 1,
    "location": "Cyber Tower",
    "serial_number": "FOC1103X0DT-48",
    "ams_barcode": "RTRTCS0010",
    "po_number": "31",
    "po_date": "2007-06-18",
    "invoice_date": null,
    "purchase_value": 68000.0,
    "current_status": "Working",
    "remarks": null,
    "supplier_name": "Wipro Infotech"
  },
  {
    "asset_type": "HSDC",
    "name": "3Com switch 24 Ports",
    "quantity": 1,
    "branch_id": 1,
    "location": "Image",
    "serial_number": "9S4FC4R18BD00",
    "ams_barcode": "STCCLS0012",
    "po_number": "04",
    "po_date": "2010-04-28",
    "invoice_date": null,
    "purchase_value": 150000.0,
    "current_status": "Working",
    "remarks": null,
    "supplier_name": "3COM"
  },
  {
    "asset_type": "HSDC",
    "name": "Cisco 3560  L3 Switch",
    "quantity": 1,
    "branch_id": 1,
    "location": "Image",
    "serial_number": "FDO1910P05H",
    "ams_barcode": "RTRTRT0009",
    "po_number": "STPH/PRJ-012/2013-2014/5626, dt.12-07-2013",
    "po_date": "2013-07-12",
    "invoice_date": "2017-11-08",
    "purchase_value": 334807.0,
    "current_status": "Working",
    "remarks": null,
    "supplier_name": "TSIIC"
  },
  {
    "asset_type": "HSDC",
    "name": "Cisco 2960 L2 switch",
    "quantity": 9,
    "branch_id": 1,
    "location": "Image",
    "serial_number": "FOC1925S04F",
    "ams_barcode": "STSWCt0004",
    "po_number": null,
    "po_date": null,
    "invoice_date": "2017-11-07",
    "purchase_value": 301647.0,
    "current_status": "Working",
    "remarks": null,
    "supplier_name": null
  },
  {
    "asset_type": "HSDC",
    "name": "Juniper EX 4200 L2 Switch",
    "quantity": 2,
    "branch_id": 1,
    "location": "J. Hills",
    "serial_number": "BM0213317845",
    "ams_barcode": "STJPSW0015",
    "po_number": "Po.No. N1350349, dt.21-08-2013",
    "po_date": "2013-08-21",
    "invoice_date": null,
    "purchase_value": 145931.42,
    "current_status": "Working",
    "remarks": null,
    "supplier_name": "Ms Inspira Enterprise India Pvt Ltd"
  },
  {
    "asset_type": "HSDC",
    "name": "Juniper EX 2200 L2 Switch",
    "quantity": 5,
    "branch_id": 1,
    "location": "Cyber Tower",
    "serial_number": "CW0213290039",
    "ams_barcode": "STJPSW0017",
    "po_number": null,
    "po_date": null,
    "invoice_date": null,
    "purchase_value": 1211304.75,
    "current_status": "Working",
    "remarks": null,
    "supplier_name": null
  },
  {
    "asset_type": "HSDC",
    "name": "Juniper EX-3300 L2 Switch",
    "quantity": 5,
    "branch_id": 1,
    "location": "Image",
    "serial_number": "GD0217160038",
    "ams_barcode": "STJPE30001",
    "po_number": "63",
    "po_date": "2017-03-22",
    "invoice_date": null,
    "purchase_value": 676359.0,
    "current_status": "Working",
    "remarks": "GA0215070393 to be replaced",
    "supplier_name": "Ms National Informatic Centre services inc"
  },
  {
    "asset_type": "HSDC",
    "name": "Juniper EX 4300 L3 Switch",
    "quantity": 4,
    "branch_id": 1,
    "location": "J. Hills",
    "serial_number": "PG3719010045",
    "ams_barcode": "STJPE40001",
    "po_number": "76",
    "po_date": "2018-12-26",
    "invoice_date": "1819-02-00",
    "purchase_value": 981552.0,
    "current_status": "Working",
    "remarks": null,
    "supplier_name": "Ms Inspira Enterprise India Pvt Ltd"
  },
  {
    "asset_type": "HSDC",
    "name": "Ruckus 24 Ports Managed Non Poe Layer 2 Access Switch",
    "quantity": 5,
    "branch_id": 1,
    "location": "J. Hills",
    "serial_number": "FEG3841T1EZ",
    "ams_barcode": "STRKRP0001",
    "po_number": "Gem Contract. No-51168773708189, 07-12-2023",
    "po_date": "2023-12-07",
    "invoice_date": null,
    "purchase_value": 479005.0,
    "current_status": "Working",
    "remarks": null,
    "supplier_name": "NETWORK ORBITER PRIVATE LIMITED"
  },
  {
    "asset_type": "HSDC",
    "name": "Cisco 3800 router",
    "quantity": 3,
    "branch_id": 1,
    "location": "Image",
    "serial_number": "FHK1118F11L",
    "ams_barcode": "RTRTCS0014",
    "po_number": "44",
    "po_date": "2005-09-12",
    "invoice_date": null,
    "purchase_value": 800000.0,
    "current_status": "Working",
    "remarks": null,
    "supplier_name": "Wipro Infotech"
  },
  {
    "asset_type": "HSDC",
    "name": "Juniper MX-480 Router",
    "quantity": 1,
    "branch_id": 1,
    "location": "J. Hills",
    "serial_number": "JN12422CEAFB",
    "ams_barcode": "RTJRMX0001",
    "po_number": "72",
    "po_date": "2015-03-31",
    "invoice_date": null,
    "purchase_value": 4315923.0,
    "current_status": "Working",
    "remarks": null,
    "supplier_name": "Ms National Informatic Centre services inc"
  },
  {
    "asset_type": "HSDC",
    "name": "Juniper MX-104 Router",
    "quantity": 1,
    "branch_id": 1,
    "location": "Image",
    "serial_number": "BH184",
    "ams_barcode": "RTJRM10001",
    "po_number": "80",
    "po_date": "2018-02-12",
    "invoice_date": null,
    "purchase_value": 931551.0,
    "current_status": "Working",
    "remarks": null,
    "supplier_name": "Ms Inspira Enterprise India Pvt Ltd"
  },
  {
    "asset_type": "HSDC",
    "name": "Juniper MX-104 Router",
    "quantity": 1,
    "branch_id": 1,
    "location": "J. Hills",
    "serial_number": "BK638",
    "ams_barcode": "RTJRM10002",
    "po_number": "05",
    "po_date": "2018-04-09",
    "invoice_date": "1819-06-01",
    "purchase_value": 998725.0,
    "current_status": "Working",
    "remarks": null,
    "supplier_name": "Ms Inspira Enterprise India Pvt Ltd"
  },
  {
    "asset_type": "HSDC",
    "name": "Cisco 7600",
    "quantity": 1,
    "branch_id": 1,
    "location": "J. Hills",
    "serial_number": "FOX1210?H7RS",
    "ams_barcode": "RTDECR0001",
    "po_number": "PO No. 126 Dt 8.02.2008",
    "po_date": null,
    "invoice_date": null,
    "purchase_value": 3565953.0,
    "current_status": "Working",
    "remarks": "Not in use",
    "supplier_name": "Nicsi"
  },
  {
    "asset_type": "HSDC",
    "name": "Cisco E1200 Wifi router",
    "quantity": 1,
    "branch_id": 1,
    "location": "J. Hills",
    "serial_number": "10822C6C236618",
    "ams_barcode": "RTRTWi0011",
    "po_number": null,
    "po_date": null,
    "invoice_date": null,
    "purchase_value": 2799.0,
    "current_status": "Working",
    "remarks": null,
    "supplier_name": "Zee Technologies"
  },
  {
    "asset_type": "HSDC",
    "name": "Cisco CAP2702",
    "quantity": 5,
    "branch_id": 1,
    "location": "Image",
    "serial_number": "FGL2010X0G0",
    "ams_barcode": "WFAPCA0001",
    "po_number": "Po.No-57,Dtd:24-03-2016",
    "po_date": "2016-03-24",
    "invoice_date": "2016-06-09",
    "purchase_value": 208636.0,
    "current_status": "Working",
    "remarks": null,
    "supplier_name": "Ms National Informatic Centre services inc"
  },
  {
    "asset_type": "HSDC",
    "name": "Cisco Controller",
    "quantity": 1,
    "branch_id": 1,
    "location": "Image",
    "serial_number": "PSZ19281N3F",
    "ams_barcode": "NENENE0004",
    "po_number": null,
    "po_date": null,
    "invoice_date": null,
    "purchase_value": null,
    "current_status": "Working",
    "remarks": "updated sl no",
    "supplier_name": null
  },
  {
    "asset_type": "HSDC",
    "name": "Cambium Force 200 wireless Bridges",
    "quantity": 18,
    "branch_id": 1,
    "location": "J. Hills",
    "serial_number": "E8TH12ZWQ1F2",
    "ams_barcode": "MDWMCA0001",
    "po_number": "Po No.70, 11-01-2018",
    "po_date": "2018-01-11",
    "invoice_date": null,
    "purchase_value": 42000.0,
    "current_status": "Working",
    "remarks": null,
    "supplier_name": "LABYRINTH  SOLUTIONS"
  },
  {
    "asset_type": "HSDC",
    "name": "Cambium Force 300 wireless Bridges",
    "quantity": 14,
    "branch_id": 1,
    "location": "J. Hills",
    "serial_number": "E6VM033NHB2P",
    "ams_barcode": "ATwlCF0001",
    "po_number": "Po No.70, 09-02-2021",
    "po_date": "2021-02-09",
    "invoice_date": null,
    "purchase_value": 19914.41,
    "current_status": "Working",
    "remarks": null,
    "supplier_name": "LABYRINTH  SOLUTIONS"
  },
  {
    "asset_type": "HSDC",
    "name": "Mimosa Wireless Bridges",
    "quantity": 10,
    "branch_id": 1,
    "location": "J. Hills",
    "serial_number": 3208373955,
    "ams_barcode": "AWWBWB0001",
    "po_number": "GEMC-511687712104700, 26-06-2023",
    "po_date": "2023-06-26",
    "invoice_date": null,
    "purchase_value": 350010.0,
    "current_status": "Working",
    "remarks": "Customer place",
    "supplier_name": "NETWORK ORBITER PRIVATE LIMITED"
  },
  {
    "asset_type": "HSDC",
    "name": "SAF Modem",
    "quantity": 4,
    "branch_id": 1,
    "location": "J. Hills",
    "serial_number": 302940100340,
    "ams_barcode": "MDRMSF0002",
    "po_number": "079,     Date 09-27-2007",
    "po_date": null,
    "invoice_date": null,
    "purchase_value": 639356.0,
    "current_status": "Working",
    "remarks": "Not in use",
    "supplier_name": "Linkquest"
  },
  {
    "asset_type": "HSDC",
    "name": "Ruckus Zoneflex R510 Wireless access points",
    "quantity": 5,
    "branch_id": 1,
    "location": "J. Hills",
    "serial_number": 521739002737,
    "ams_barcode": "WFAPRK0006",
    "po_number": "Po dt 79; 06-02-2018",
    "po_date": "2018-02-06",
    "invoice_date": null,
    "purchase_value": 109705.0,
    "current_status": "Working",
    "remarks": null,
    "supplier_name": "Netcon Technologies India Pvt Ltd"
  },
  {
    "asset_type": "HSDC",
    "name": "Ruckus Zoneflex R650",
    "quantity": 5,
    "branch_id": 1,
    "location": "Image",
    "serial_number": 242339004434,
    "ams_barcode": "WFAPRR0001",
    "po_number": "Gem Contract. No-511687726573540, 25-07-2023",
    "po_date": "2023-07-25",
    "invoice_date": null,
    "purchase_value": 460686.45,
    "current_status": "Working",
    "remarks": null,
    "supplier_name": "NORTH POINT INFOTECH PRIVATE LIMITED"
  },
  {
    "asset_type": "HSDC",
    "name": "D-Link 12 port DES-1024C",
    "quantity": 1,
    "branch_id": 1,
    "location": "Cyber tpwer",
    "serial_number": "QXAA2G4022369",
    "ams_barcode": "STSWDL0001",
    "po_number": null,
    "po_date": null,
    "invoice_date": null,
    "purchase_value": null,
    "current_status": "Working",
    "remarks": null,
    "supplier_name": null
  },
  {
    "asset_type": "COMPUTER",
    "name": "Lenovo V520 PC",
    "quantity": 12,
    "branch_id": 1,
    "location": "J  Hills",
    "serial_number": "PG012LL9",
    "ams_barcode": "PCPCLN0002",
    "po_number": "Po No -59, Dt- 22-11-2017",
    "po_date": "2017-11-22",
    "invoice_date": null,
    "purchase_value": 34991.0,
    "current_status": "Working",
    "remarks": "No Ram, not in use",
    "supplier_name": "Aditya Infotech Pvt.Ltd"
  },
  {
    "asset_type": "COMPUTER",
    "name": "Acer S2670G Desktop",
    "quantity": 15,
    "branch_id": 1,
    "location": "Cyber Towers",
    "serial_number": "UXBETSI356L1717824",
    "ams_barcode": "DTADAD0001",
    "po_number": "Po No.76 Dt - 18-03-2021",
    "po_date": "2021-03-18",
    "invoice_date": null,
    "purchase_value": 45444.0,
    "current_status": "Working",
    "remarks": null,
    "supplier_name": "JMD Enterprises"
  },
  {
    "asset_type": "COMPUTER",
    "name": "HLBS CM44 Desktop",
    "quantity": 12,
    "branch_id": 1,
    "location": "Cyber Towers",
    "serial_number": "04H03L2023B39427",
    "ams_barcode": "PCHLHL0010",
    "po_number": "Contract No - GEMC-511687748821263\n14-02-2023",
    "po_date": "2023-02-14",
    "invoice_date": null,
    "purchase_value": 54244.0,
    "current_status": "Working",
    "remarks": null,
    "supplier_name": "HLBS Tech Pvt.Ltd"
  },
  {
    "asset_type": "COMPUTER",
    "name": "HP Desk top",
    "quantity": 12,
    "branch_id": 1,
    "location": "J  Hills",
    "serial_number": "INA437SH5T",
    "ams_barcode": "PCPCDT0009",
    "po_number": "P.O.- 29,  Dt. 08.01.2014",
    "po_date": null,
    "invoice_date": null,
    "purchase_value": 41111.4,
    "current_status": "Working",
    "remarks": "Updated location",
    "supplier_name": "M/s. DGS & D"
  },
  {
    "asset_type": "COMPUTER",
    "name": "All in one PC",
    "quantity": 1,
    "branch_id": 1,
    "location": "Cyber Towers",
    "serial_number": "Dell Inspiron 7720",
    "ams_barcode": "PCADDI0002",
    "po_number": "PO - 121 Dt - 04.03.2024",
    "po_date": null,
    "invoice_date": null,
    "purchase_value": 137925.0,
    "current_status": "Working",
    "remarks": null,
    "supplier_name": "SVS Technologies"
  },
  {
    "asset_type": "COMPUTER",
    "name": "Lenovo V330",
    "quantity": 1,
    "branch_id": 1,
    "location": "J  Hills",
    "serial_number": "MP1LZWH4",
    "ams_barcode": "LPLLV30008",
    "po_number": "P.O No 34\n10/07/2019",
    "po_date": "2019-07-10",
    "invoice_date": null,
    "purchase_value": 54652.54,
    "current_status": "Working",
    "remarks": "upadated location",
    "supplier_name": "SVS Technologies"
  },
  {
    "asset_type": "COMPUTER",
    "name": "Lenovo Yoga 7i",
    "quantity": 1,
    "branch_id": 1,
    "location": "Image",
    "serial_number": "PF2JZ1TS",
    "ams_barcode": "LPLLLL0002",
    "po_number": "P.O No 78\nDt. 23/03/2021",
    "po_date": "2021-03-23",
    "invoice_date": null,
    "purchase_value": 102070.0,
    "current_status": "Working",
    "remarks": null,
    "supplier_name": "P.L Computers"
  },
  {
    "asset_type": "COMPUTER",
    "name": "Dell Latitude 3500",
    "quantity": 1,
    "branch_id": 1,
    "location": "Cyber Towers",
    "serial_number": "9JW4KW2",
    "ams_barcode": "LPDLDL0001",
    "po_number": "P.O No - 77\nDt.20/01/2020",
    "po_date": "2020-01-20",
    "invoice_date": null,
    "purchase_value": 62813.55,
    "current_status": "Working",
    "remarks": "updated location",
    "supplier_name": "Digitech Electronic systems pvt.Ltd"
  },
  {
    "asset_type": "COMPUTER",
    "name": "Dell Latitude 3410",
    "quantity": 6,
    "branch_id": 1,
    "location": "Cyber Towers",
    "serial_number": "7L80563",
    "ams_barcode": "LPDLDL0002",
    "po_number": "P.O No - 41\nDt.28/09/2020",
    "po_date": "2020-09-28",
    "invoice_date": null,
    "purchase_value": 66558.48,
    "current_status": "Working",
    "remarks": null,
    "supplier_name": "SVS Technologies"
  },
  {
    "asset_type": "COMPUTER",
    "name": "Dell Vostro 3500",
    "quantity": 6,
    "branch_id": 1,
    "location": "Cyber Towers",
    "serial_number": "97SDRK3",
    "ams_barcode": "LPDLDV0005",
    "po_number": "Contract.no GEMC-511687764153500\nDt. 20/09/2021",
    "po_date": "2021-09-20",
    "invoice_date": null,
    "purchase_value": 67386.99,
    "current_status": "Working",
    "remarks": null,
    "supplier_name": "Odissi Systems & Solutions"
  },
  {
    "asset_type": "COMPUTER",
    "name": "Dell Latitude 3420",
    "quantity": 1,
    "branch_id": 1,
    "location": "J  Hills",
    "serial_number": "8KS5KL3",
    "ams_barcode": "LPDLDL0027",
    "po_number": "GEMC-511687799640023\nDt. 06/04/2022",
    "po_date": "2022-04-06",
    "invoice_date": null,
    "purchase_value": 74699.0,
    "current_status": "Working",
    "remarks": "Updated location",
    "supplier_name": "Gltech Solutions PVT Ltd"
  },
  {
    "asset_type": "COMPUTER",
    "name": "Dell Vostro 15 3510",
    "quantity": 1,
    "branch_id": 1,
    "location": "Cyber Towers",
    "serial_number": "2C0RTN3",
    "ams_barcode": "LPDLDV0008",
    "po_number": "Not available",
    "po_date": null,
    "invoice_date": null,
    "purchase_value": 62181.0,
    "current_status": "Working",
    "remarks": null,
    "supplier_name": "Saphire Computers"
  },
  {
    "asset_type": "COMPUTER",
    "name": "Dell Latitude 5430",
    "quantity": 10,
    "branch_id": 1,
    "location": "J  Hills",
    "serial_number": "JG7Y9W3",
    "ams_barcode": "LPDLDL0016",
    "po_number": "GEMC-511687728043284\nDt.09/03/2023",
    "po_date": "2023-03-09",
    "invoice_date": null,
    "purchase_value": 99000.0,
    "current_status": "Working",
    "remarks": null,
    "supplier_name": "DHARAM AGENCIES"
  },
  {
    "asset_type": "COMPUTER",
    "name": "HP ProBook 450 G9",
    "quantity": 6,
    "branch_id": 1,
    "location": "Cyber Towers",
    "serial_number": "5CD3131DQ5",
    "ams_barcode": "LPHPHL0003",
    "po_number": "Gem Contract. No-511687749041950\nDt. 08/08/2023",
    "po_date": "2023-08-08",
    "invoice_date": null,
    "purchase_value": 74000.0,
    "current_status": "Working",
    "remarks": null,
    "supplier_name": "PKS Computers"
  },
  {
    "asset_type": "COMPUTER",
    "name": "HP Laser Jet 1020",
    "quantity": 1,
    "branch_id": 1,
    "location": "Cyber Towers",
    "serial_number": "CNCKG25704",
    "ams_barcode": "PTHPPT0008",
    "po_number": "P.O.-43,  Dt.-09-12-2005",
    "po_date": "2005-12-09",
    "invoice_date": null,
    "purchase_value": 9500.0,
    "current_status": "Working",
    "remarks": null,
    "supplier_name": "M/s. MAX Refills"
  },
  {
    "asset_type": "COMPUTER",
    "name": "HP LaserJet 1020 Plus",
    "quantity": 10,
    "branch_id": 1,
    "location": "Cyber Towers",
    "serial_number": "VNC3623919",
    "ams_barcode": "PTHPPT0020",
    "po_number": "55",
    "po_date": "2007-07-23",
    "invoice_date": null,
    "purchase_value": 38365.38,
    "current_status": "Working",
    "remarks": null,
    "supplier_name": "Pan Infotech"
  },
  {
    "asset_type": "COMPUTER",
    "name": "HP Laser jet P1007",
    "quantity": 1,
    "branch_id": 1,
    "location": "J  Hills",
    "serial_number": "VNFNS80090",
    "ams_barcode": "PTHPHL0001",
    "po_number": "21",
    "po_date": "2011-02-08",
    "invoice_date": null,
    "purchase_value": 5710.0,
    "current_status": "Working",
    "remarks": "Updated location",
    "supplier_name": "Kendriya Bhandar"
  },
  {
    "asset_type": "COMPUTER",
    "name": "HP Multifunction Printer1218nfs",
    "quantity": 1,
    "branch_id": 1,
    "location": "Cyber Towers",
    "serial_number": "CNJ8FCFG7D",
    "ams_barcode": "PTMFHM0001",
    "po_number": "05",
    "po_date": null,
    "invoice_date": null,
    "purchase_value": 18249.0,
    "current_status": "Working",
    "remarks": null,
    "supplier_name": "Kendriya Bhandar"
  },
  {
    "asset_type": "COMPUTER",
    "name": "HP CP 1025 NW Color Printer",
    "quantity": 1,
    "branch_id": 1,
    "location": "Cyber Towers",
    "serial_number": "CNF5Q01739",
    "ams_barcode": "PTHCHC0001",
    "po_number": "04",
    "po_date": "2014-04-21",
    "invoice_date": null,
    "purchase_value": 20580.0,
    "current_status": "Working",
    "remarks": null,
    "supplier_name": "Kendriya Bhandar"
  },
  {
    "asset_type": "COMPUTER",
    "name": "HP Laserjet Pro 400 M425DN",
    "quantity": 1,
    "branch_id": 1,
    "location": "J  Hills",
    "serial_number": "CNF8H7P1M4",
    "ams_barcode": "PTMFP40001",
    "po_number": "01",
    "po_date": "2016-04-04",
    "invoice_date": null,
    "purchase_value": 42900.0,
    "current_status": "Working",
    "remarks": "Updated location",
    "supplier_name": "Prenex System"
  },
  {
    "asset_type": "COMPUTER",
    "name": "HP Laserjet Pro M427 FDW",
    "quantity": 2,
    "branch_id": 1,
    "location": "Image",
    "serial_number": "PHBBJ5RGNX",
    "ams_barcode": "PTMFDW0001",
    "po_number": "22",
    "po_date": null,
    "invoice_date": null,
    "purchase_value": 49560.0,
    "current_status": "Working",
    "remarks": null,
    "supplier_name": "Prenex System"
  },
  {
    "asset_type": "COMPUTER",
    "name": "Epson LW 900P Label Printer",
    "quantity": 1,
    "branch_id": 1,
    "location": "Image",
    "serial_number": "R8ZZ520014H",
    "ams_barcode": "LMEPLW0001",
    "po_number": "Po N0  29-06-2016",
    "po_date": "2016-06-29",
    "invoice_date": null,
    "purchase_value": 10164.0,
    "current_status": "Working",
    "remarks": null,
    "supplier_name": "Prenex System"
  },
  {
    "asset_type": "COMPUTER",
    "name": "HP Laserjet M126NW",
    "quantity": 1,
    "branch_id": 1,
    "location": "Cyber Towers",
    "serial_number": "CNBKL8KFNG",
    "ams_barcode": "PTMF1N0001",
    "po_number": "57",
    "po_date": "2018-08-10",
    "invoice_date": null,
    "purchase_value": 18273.0,
    "current_status": "Working",
    "remarks": null,
    "supplier_name": "Mangal Trading Company"
  },
  {
    "asset_type": "COMPUTER",
    "name": "HP M 227",
    "quantity": 1,
    "branch_id": 1,
    "location": "J  Hills",
    "serial_number": "6LBQB041632",
    "ams_barcode": "PHOECP0006",
    "po_number": "46",
    "po_date": "2017-09-22",
    "invoice_date": null,
    "purchase_value": 30450.0,
    "current_status": "Working",
    "remarks": "Not in use",
    "supplier_name": "Prenex System"
  },
  {
    "asset_type": "COMPUTER",
    "name": "Koycera Ecosys M2040dn",
    "quantity": 7,
    "branch_id": 1,
    "location": "Cyber Towers",
    "serial_number": "VYB2495545",
    "ams_barcode": "PTKCES0002",
    "po_number": "GEMC.No-511687782229213\nDt 28-06-2022",
    "po_date": "2022-06-28",
    "invoice_date": null,
    "purchase_value": 35000.0,
    "current_status": "Working",
    "remarks": null,
    "supplier_name": "Moksha Enterprises"
  },
  {
    "asset_type": "COMPUTER",
    "name": "HP LaserJet Pro M202dw",
    "quantity": 2,
    "branch_id": 1,
    "location": "Cyber Towers",
    "serial_number": "VNC4L83240",
    "ams_barcode": "PTHPHP0003",
    "po_number": "GEMC-511687705148691\nDt 07-12-2021",
    "po_date": "2021-12-07",
    "invoice_date": null,
    "purchase_value": 12329.66,
    "current_status": "Working",
    "remarks": null,
    "supplier_name": "Gazo Document Solution Pvt.Ltd"
  },
  {
    "asset_type": "COMPUTER",
    "name": "HP Laser Jet M233SDN",
    "quantity": 1,
    "branch_id": 1,
    "location": "Cyber Towers",
    "serial_number": "VNP6H15153",
    "ams_barcode": "PTHPHP0004",
    "po_number": "GEMC-511687794290831, \nDt. 06-20-2023",
    "po_date": null,
    "invoice_date": null,
    "purchase_value": 20037.29,
    "current_status": "Working",
    "remarks": null,
    "supplier_name": "M/s. Emerging Solutions"
  },
  {
    "asset_type": "COMPUTER",
    "name": "Canon mf 269",
    "quantity": 2,
    "branch_id": 1,
    "location": "Cyber Towers",
    "serial_number": "2DR02861",
    "ams_barcode": "PTCMF0002",
    "po_number": "84",
    "po_date": "2020-02-11",
    "invoice_date": null,
    "purchase_value": 31516.0,
    "current_status": "Working",
    "remarks": null,
    "supplier_name": "Laser Systems Pvt.Ltd"
  },
  {
    "asset_type": "COMPUTER",
    "name": "Lexmark Mx421",
    "quantity": 3,
    "branch_id": 1,
    "location": "Cyber Towers",
    "serial_number": "701793530FRLS",
    "ams_barcode": "PTLPMX0001",
    "po_number": "69",
    "po_date": "2019-10-12",
    "invoice_date": null,
    "purchase_value": 46990.0,
    "current_status": "Working",
    "remarks": null,
    "supplier_name": "Sai Baba Business Machines Pvt Ltd"
  },
  {
    "asset_type": "COMPUTER",
    "name": "Sophos X2100",
    "quantity": 1,
    "branch_id": 1,
    "location": "J  Hills",
    "serial_number": "X21006KY2GQW98E",
    "ams_barcode": "SXSXSH0001",
    "po_number": "GEMC-511687766773309\n16-06-2022",
    "po_date": "2022-06-16",
    "invoice_date": null,
    "purchase_value": 362500.0,
    "current_status": "Working",
    "remarks": null,
    "supplier_name": "Trace Network & engineering Pvt Ltd"
  },
  {
    "asset_type": "COMPUTER",
    "name": "Wi-Jungle U500EX Firewall",
    "quantity": 1,
    "branch_id": 1,
    "location": "J  Hills",
    "serial_number": "W1723U500EXDI2008302",
    "ams_barcode": "WUWUNA0001",
    "po_number": "GEMC-511687718469133\n26-08-2022",
    "po_date": "2022-08-26",
    "invoice_date": null,
    "purchase_value": 708000.0,
    "current_status": "Working",
    "remarks": null,
    "supplier_name": "Httpcart Technologies Pvt.Ltd"
  },
  {
    "asset_type": "COMPUTER",
    "name": "QSAN Nas Storage",
    "quantity": 2,
    "branch_id": 1,
    "location": "J  Hills",
    "serial_number": "XN236Q00135",
    "ams_barcode": "SENSNA0002",
    "po_number": "Contract No: GEMC-511687750587278\n22-06-2023",
    "po_date": "2023-06-22",
    "invoice_date": null,
    "purchase_value": 420905.93,
    "current_status": "Working",
    "remarks": null,
    "supplier_name": "Istorage India Pvt Ltd"
  },
  {
    "asset_type": "COMPUTER",
    "name": "Netgear Ready NAS 316-RN31600",
    "quantity": 1,
    "branch_id": 1,
    "location": "J  Hills",
    "serial_number": "3C623500009A0",
    "ams_barcode": "SENSNA0001",
    "po_number": "41",
    "po_date": "2013-11-19",
    "invoice_date": null,
    "purchase_value": 69825.0,
    "current_status": "Working",
    "remarks": null,
    "supplier_name": "Sara Infoway Pvt Ltd"
  },
  {
    "asset_type": "COMPUTER",
    "name": "Fusionstor invento i6000",
    "quantity": 2,
    "branch_id": 1,
    "location": "J  Hills",
    "serial_number": "MR598806022020-3",
    "ams_barcode": "SRSRFS0003",
    "po_number": "Contract No - GEMC-511687724722045\n17-01-2020",
    "po_date": "2020-01-17",
    "invoice_date": null,
    "purchase_value": 323320.0,
    "current_status": "Working",
    "remarks": null,
    "supplier_name": "Mega Networks Pvt Ltd"
  },
  {
    "asset_type": "COMPUTER",
    "name": "HP DL 380e Server",
    "quantity": 2,
    "branch_id": 1,
    "location": "J  Hills",
    "serial_number": "SGH444YP38",
    "ams_barcode": "SRSRSH0011",
    "po_number": "16",
    "po_date": "2014-06-19",
    "invoice_date": null,
    "purchase_value": 320443.0,
    "current_status": "Working",
    "remarks": null,
    "supplier_name": "National Infomatics center"
  },
  {
    "asset_type": "COMPUTER",
    "name": "HP server 580R07CT0",
    "quantity": 2,
    "branch_id": 1,
    "location": "J  Hills",
    "serial_number": "SGH111X63N",
    "ams_barcode": "SRSRSH0001",
    "po_number": "66",
    "po_date": "2011-01-02",
    "invoice_date": null,
    "purchase_value": 320906.5,
    "current_status": "Working",
    "remarks": null,
    "supplier_name": "Progressive Infotech"
  },
  {
    "asset_type": "COMPUTER",
    "name": "HP Server",
    "quantity": 1,
    "branch_id": 1,
    "location": "J  Hills",
    "serial_number": "TWTS4700SA",
    "ams_barcode": "SRSRSH0012",
    "po_number": "P.O.- 058,  Dt.- 11-09-2005",
    "po_date": "2005-09-11",
    "invoice_date": null,
    "purchase_value": 447922.0,
    "current_status": "Working",
    "remarks": "File Server",
    "supplier_name": "R R Peripherals"
  },
  {
    "asset_type": "COMPUTER",
    "name": "Dell Workstation",
    "quantity": 1,
    "branch_id": 1,
    "location": "Image",
    "serial_number": "9PK0YC2",
    "ams_barcode": "DTDWDW0001",
    "po_number": "TSIIC  Provided",
    "po_date": null,
    "invoice_date": null,
    "purchase_value": 150000.0,
    "current_status": "Working",
    "remarks": null,
    "supplier_name": "TSIIC  Provided"
  },
  {
    "asset_type": "COMPUTER",
    "name": "Avision network scanner",
    "quantity": 1,
    "branch_id": 1,
    "location": "Cyber Towers",
    "serial_number": "A09780449B210010",
    "ams_barcode": "SCSCDS0001",
    "po_number": "13",
    "po_date": "2020-06-07",
    "invoice_date": null,
    "purchase_value": 39830.0,
    "current_status": "Working",
    "remarks": null,
    "supplier_name": "Vishal Sharma"
  },
  {
    "asset_type": "COMPUTER",
    "name": "Avision AD120 Document Scanner",
    "quantity": 1,
    "branch_id": 1,
    "location": "Cyber Towers",
    "serial_number": "B105129629280128",
    "ams_barcode": "SCSCAC0001",
    "po_number": "Gem Contract. No-511687794544962 \nDt  10-12-2023",
    "po_date": "2023-12-10",
    "invoice_date": null,
    "purchase_value": 24849.0,
    "current_status": "Working",
    "remarks": null,
    "supplier_name": "NISARGA INFORMATION TECHNOLOGY SOLUTIONS PRIVATE LIMITED"
  },
  {
    "asset_type": "COMPUTER",
    "name": "Polycom Realpresence Group 500 Video Conference system",
    "quantity": 1,
    "branch_id": 1,
    "location": "Cyber Towers",
    "serial_number": "821607454CF7CV",
    "ams_barcode": "PLPRPR0001",
    "po_number": "44",
    "po_date": "2016-02-11",
    "invoice_date": null,
    "purchase_value": 329227.0,
    "current_status": "Working",
    "remarks": null,
    "supplier_name": "DGS&D"
  },
  {
    "asset_type": "COMPUTER",
    "name": "Polycom Realpresence Group 300 Video Conference system",
    "quantity": 1,
    "branch_id": 1,
    "location": "Image",
    "serial_number": "82153343CAFED5",
    "ams_barcode": "SECCCC0023",
    "po_number": "TSIIC  01-08-2016",
    "po_date": "2016-08-01",
    "invoice_date": null,
    "purchase_value": 429070.0,
    "current_status": "Working",
    "remarks": null,
    "supplier_name": "TSIIC"
  },
  {
    "asset_type": "COMPUTER",
    "name": "LG 65\" LED Display System",
    "quantity": 1,
    "branch_id": 1,
    "location": "Cyber Towers",
    "serial_number": "603KCMRA8867",
    "ams_barcode": "LE65LG0001",
    "po_number": "Po No No 51 dt.03-01-2016",
    "po_date": "2016-01-03",
    "invoice_date": null,
    "purchase_value": 223306.0,
    "current_status": "Working",
    "remarks": null,
    "supplier_name": "National Infomatics center"
  },
  {
    "asset_type": "COMPUTER",
    "name": "Samsung 65 inch",
    "quantity": 1,
    "branch_id": 1,
    "location": "Image",
    "serial_number": "OA573PCGBOOO14Z",
    "ams_barcode": "LE65LG0002",
    "po_number": "2016",
    "po_date": null,
    "invoice_date": null,
    "purchase_value": 376377.0,
    "current_status": "Working",
    "remarks": null,
    "supplier_name": "TSIIC"
  },
  {
    "asset_type": "COMPUTER",
    "name": "Samsung 55 inch",
    "quantity": 1,
    "branch_id": 1,
    "location": "Image",
    "serial_number": null,
    "ams_barcode": "TVSSST0005",
    "po_number": null,
    "po_date": null,
    "invoice_date": null,
    "purchase_value": 236580.0,
    "current_status": "Working",
    "remarks": null,
    "supplier_name": null
  },
  {
    "asset_type": "COMPUTER",
    "name": "Sony TV 32''",
    "quantity": 1,
    "branch_id": 1,
    "location": "Cyber Towers",
    "serial_number": 6164259,
    "ams_barcode": "ASTVTV0002",
    "po_number": "P.O.-083, Dt. 12-26-2009",
    "po_date": null,
    "invoice_date": null,
    "purchase_value": 40320.0,
    "current_status": "Working",
    "remarks": null,
    "supplier_name": "Aditya Electronics"
  },
  {
    "asset_type": "COMPUTER",
    "name": "SAMSUNG 43'' LED",
    "quantity": 1,
    "branch_id": 1,
    "location": "J  Hills",
    "serial_number": "0APXHPAW200077N",
    "ams_barcode": "SSSTSS0001",
    "po_number": "GEMC-511687788486950,\nDt.- 03.05.2023",
    "po_date": null,
    "invoice_date": null,
    "purchase_value": 42240.0,
    "current_status": "Working",
    "remarks": null,
    "supplier_name": "BIGHUB SOLUTIONS PRIVATE LIMITED"
  },
  {
    "asset_type": "COMPUTER",
    "name": "Samsung LCD 32''",
    "quantity": 1,
    "branch_id": 1,
    "location": "J  Hills",
    "serial_number": 1695,
    "ams_barcode": "TVSSST0004",
    "po_number": "P.O.-083, Dt. 12-26-2010",
    "po_date": null,
    "invoice_date": null,
    "purchase_value": 49000.0,
    "current_status": "Working",
    "remarks": null,
    "supplier_name": "Thirumala music center"
  },
  {
    "asset_type": "COMPUTER",
    "name": "HP440 G1",
    "quantity": 1,
    "branch_id": 1,
    "location": "J Hills",
    "serial_number": "INA436S7K2",
    "ams_barcode": "LPHPpb0006",
    "po_number": "27",
    "po_date": null,
    "invoice_date": null,
    "purchase_value": 63060.21,
    "current_status": "Working",
    "remarks": null,
    "supplier_name": "DGS&D"
  },
  {
    "asset_type": "COMPUTER",
    "name": "HP",
    "quantity": 1,
    "branch_id": 1,
    "location": "J Hills",
    "serial_number": "INA523X4N6",
    "ams_barcode": "PCPCDT0037",
    "po_number": "03",
    "po_date": null,
    "invoice_date": null,
    "purchase_value": 41161.65,
    "current_status": "Working",
    "remarks": null,
    "supplier_name": "DGS&D"
  },
  {
    "asset_type": "COMPUTER",
    "name": "Lexmark MX421 ADE",
    "quantity": 1,
    "branch_id": 1,
    "location": "J Hills",
    "serial_number": "701793530FRM4",
    "ams_barcode": "PTLPMX0002",
    "po_number": "69",
    "po_date": null,
    "invoice_date": null,
    "purchase_value": 39822.0,
    "current_status": "Working",
    "remarks": null,
    "supplier_name": "Saibaba business machines pvt ltd"
  },
  {
    "asset_type": "COMPUTER",
    "name": "HP-All in One Colour printer",
    "quantity": 1,
    "branch_id": 1,
    "location": "J  Hills",
    "serial_number": "VNF3200472",
    "ams_barcode": "PTHCHC0002",
    "po_number": "PURCHASE ORDER (G) No. 110,\nDate: 14.02.2025",
    "po_date": null,
    "invoice_date": null,
    "purchase_value": 67850.0,
    "current_status": "Working",
    "remarks": null,
    "supplier_name": "M/s PSR IT Services Pvt. LTD"
  },
  {
    "asset_type": "COMPUTER",
    "name": "Laptop",
    "quantity": 2,
    "branch_id": 1,
    "location": "J  Hills",
    "serial_number": "4J07DY3",
    "ams_barcode": "LPDLDL0032",
    "po_number": "STPH/PO/2024-25/AUG/PG/51/4225",
    "po_date": null,
    "invoice_date": null,
    "purchase_value": 280800.0,
    "current_status": "Working",
    "remarks": null,
    "supplier_name": "M/s. PSR IT SERVICES PVT. LTD"
  },
  {
    "asset_type": "COMPUTER",
    "name": "Laptop",
    "quantity": 1,
    "branch_id": 1,
    "location": "J  Hills",
    "serial_number": "LR0AWF7K",
    "ams_barcode": "LPLLV30003",
    "po_number": "P.O. 62,12/06/2017",
    "po_date": "2017-06-12",
    "invoice_date": null,
    "purchase_value": 55499.0,
    "current_status": "Working",
    "remarks": null,
    "supplier_name": "Lan Times Technologies"
  },
  {
    "asset_type": "ELECTRICAL",
    "name": "125 KVA DG Set",
    "quantity": 2,
    "branch_id": 1,
    "location": "J. Hills",
    "serial_number": "25195032 & 9321027-126",
    "ams_barcode": "FXDGDG0001",
    "po_number": "STPH/93-94/DG-02, Dtd: 20-11-1993",
    "po_date": "1993-11-20",
    "invoice_date": null,
    "purchase_value": 259000.0,
    "current_status": "Working",
    "remarks": null,
    "supplier_name": "Powerica Limited"
  },
  {
    "asset_type": "ELECTRICAL",
    "name": "38 mts Angular tower",
    "quantity": 1,
    "branch_id": 1,
    "location": "J. Hills",
    "serial_number": null,
    "ams_barcode": "FXT T 0026",
    "po_number": "1998",
    "po_date": null,
    "invoice_date": null,
    "purchase_value": 400000.0,
    "current_status": "Working",
    "remarks": null,
    "supplier_name": null
  },
  {
    "asset_type": "ELECTRICAL",
    "name": "26 mts Angular tower",
    "quantity": 1,
    "branch_id": 1,
    "location": "J. Hills",
    "serial_number": null,
    "ams_barcode": "FXT T 0001",
    "po_number": null,
    "po_date": null,
    "invoice_date": null,
    "purchase_value": 300000.0,
    "current_status": "Working",
    "remarks": null,
    "supplier_name": null
  },
  {
    "asset_type": "ELECTRICAL",
    "name": "Transformer 200KVA",
    "quantity": 1,
    "branch_id": 1,
    "location": "J. Hills",
    "serial_number": 16976,
    "ams_barcode": "ElTRTR0003",
    "po_number": "Po No.34  dt: 15-12-2009",
    "po_date": "2009-12-15",
    "invoice_date": null,
    "purchase_value": 405000.0,
    "current_status": "Working",
    "remarks": null,
    "supplier_name": "CPWD"
  },
  {
    "asset_type": "ELECTRICAL",
    "name": "Switch Fuse Unit (SFU) 11KV",
    "quantity": 1,
    "branch_id": 1,
    "location": "J. Hills",
    "serial_number": "10088K756",
    "ams_barcode": "ElTRTR0001",
    "po_number": null,
    "po_date": null,
    "invoice_date": null,
    "purchase_value": 76000.0,
    "current_status": "Working",
    "remarks": null,
    "supplier_name": null
  },
  {
    "asset_type": "ELECTRICAL",
    "name": "Power factor control panel-100KVAR",
    "quantity": 1,
    "branch_id": 1,
    "location": "J. Hills",
    "serial_number": 422367,
    "ams_barcode": "POPWPF0001",
    "po_number": null,
    "po_date": null,
    "invoice_date": null,
    "purchase_value": 249300.0,
    "current_status": "Working",
    "remarks": null,
    "supplier_name": null
  },
  {
    "asset_type": "ELECTRICAL",
    "name": "10 Ton PAC Blue Star",
    "quantity": 1,
    "branch_id": 1,
    "location": "J. Hills",
    "serial_number": "ODU:.PCD 502 F09000068\nIDU PCX-352UFR109000012",
    "ams_barcode": "ElACAC0006",
    "po_number": "66",
    "po_date": "2009-11-21",
    "invoice_date": null,
    "purchase_value": 420000.0,
    "current_status": "Working",
    "remarks": null,
    "supplier_name": "Air control engineers"
  },
  {
    "asset_type": "ELECTRICAL",
    "name": "2 Ton  Carrier",
    "quantity": 1,
    "branch_id": 1,
    "location": "J. Hills",
    "serial_number": "ODU500171223091003959 \nIDU500183624091003792",
    "ams_barcode": "ElACCR0034",
    "po_number": "71",
    "po_date": "2009-11-26",
    "invoice_date": null,
    "purchase_value": 31915.0,
    "current_status": "Working",
    "remarks": null,
    "supplier_name": null
  },
  {
    "asset_type": "ELECTRICAL",
    "name": "2 Ton  Carrier",
    "quantity": 3,
    "branch_id": 1,
    "location": "Image",
    "serial_number": "IDU-500312852149000038  \nODU-500312951149000029",
    "ams_barcode": "ElAC2T0006",
    "po_number": "STPH/PRJ-012/2013-2014/5626, 1Dt : 12-07-2013",
    "po_date": "2013-07-12",
    "invoice_date": null,
    "purchase_value": 44300.0,
    "current_status": "Working",
    "remarks": null,
    "supplier_name": "TSIIC"
  },
  {
    "asset_type": "ELECTRICAL",
    "name": "8.5 Ton  PAC  Stulz",
    "quantity": 2,
    "branch_id": 1,
    "location": "Image",
    "serial_number": "ODU-HR56ODU12140097,\nODU-HR56ODU12140096",
    "ams_barcode": "ElAC9T0001",
    "po_number": null,
    "po_date": null,
    "invoice_date": null,
    "purchase_value": 1676552.56,
    "current_status": "Working",
    "remarks": null,
    "supplier_name": null
  },
  {
    "asset_type": "ELECTRICAL",
    "name": "2 Ton carrier",
    "quantity": 5,
    "branch_id": 1,
    "location": "Cyber Tower",
    "serial_number": "500212016118002316 \nODU 500211713118002435",
    "ams_barcode": "ElACCR0036",
    "po_number": "PO -84 Dt 17.03.2011",
    "po_date": null,
    "invoice_date": null,
    "purchase_value": 34500.0,
    "current_status": "Working",
    "remarks": null,
    "supplier_name": "Kendriya bandar"
  },
  {
    "asset_type": "ELECTRICAL",
    "name": "1 Ton Carrier",
    "quantity": 1,
    "branch_id": 1,
    "location": "J. Hills",
    "serial_number": "ODU 5003141251519008603\nIDU 500314031159009364",
    "ams_barcode": "ElACTS0005",
    "po_number": null,
    "po_date": null,
    "invoice_date": null,
    "purchase_value": 33800.0,
    "current_status": "Working",
    "remarks": null,
    "supplier_name": null
  },
  {
    "asset_type": "ELECTRICAL",
    "name": "3 Ton Package carrier",
    "quantity": 2,
    "branch_id": 1,
    "location": "Image",
    "serial_number": "ODU-500181405158000020",
    "ams_barcode": "ElACCR0043",
    "po_number": "2016",
    "po_date": null,
    "invoice_date": null,
    "purchase_value": 76082.17,
    "current_status": "Working",
    "remarks": null,
    "supplier_name": "TSIIC"
  },
  {
    "asset_type": "ELECTRICAL",
    "name": "1 Ton Casette Bluestar",
    "quantity": 4,
    "branch_id": 1,
    "location": "Image",
    "serial_number": "DCC12C17F00110",
    "ams_barcode": "ACACAC0020",
    "po_number": "2017",
    "po_date": null,
    "invoice_date": null,
    "purchase_value": 214167.8,
    "current_status": "Working",
    "remarks": null,
    "supplier_name": "NPCC"
  },
  {
    "asset_type": "ELECTRICAL",
    "name": "1.5Ton Casette Bluestar",
    "quantity": 4,
    "branch_id": 1,
    "location": "Image",
    "serial_number": "DLC18B17F00008",
    "ams_barcode": "ACACAC0024",
    "po_number": null,
    "po_date": null,
    "invoice_date": null,
    "purchase_value": 223388.0,
    "current_status": "Working",
    "remarks": null,
    "supplier_name": null
  },
  {
    "asset_type": "ELECTRICAL",
    "name": "2.0Ton Casette Bluestar",
    "quantity": 6,
    "branch_id": 1,
    "location": "Image",
    "serial_number": "DLC24C17F00132",
    "ams_barcode": "ACACAC0028",
    "po_number": null,
    "po_date": null,
    "invoice_date": null,
    "purchase_value": 341028.0,
    "current_status": "Working",
    "remarks": null,
    "supplier_name": null
  },
  {
    "asset_type": "ELECTRICAL",
    "name": "3.0Ton Casette Bluestar",
    "quantity": 2,
    "branch_id": 1,
    "location": "Image",
    "serial_number": "DLC38C17F00162",
    "ams_barcode": "ACACAC0034",
    "po_number": null,
    "po_date": null,
    "invoice_date": null,
    "purchase_value": 129866.0,
    "current_status": "Working",
    "remarks": null,
    "supplier_name": null
  },
  {
    "asset_type": "ELECTRICAL",
    "name": "3 Ton ductable Bluestar",
    "quantity": 2,
    "branch_id": 1,
    "location": "Image",
    "serial_number": "DSD-36C17F00231,",
    "ams_barcode": "ACACAC0036",
    "po_number": null,
    "po_date": null,
    "invoice_date": null,
    "purchase_value": 114558.0,
    "current_status": "Working",
    "remarks": null,
    "supplier_name": null
  },
  {
    "asset_type": "ELECTRICAL",
    "name": "2 Ton Split AC bluestar",
    "quantity": 3,
    "branch_id": 1,
    "location": "Image",
    "serial_number": "2403335600273300160230,",
    "ams_barcode": "ACACAC0038",
    "po_number": null,
    "po_date": null,
    "invoice_date": null,
    "purchase_value": 300600.0,
    "current_status": "Working",
    "remarks": null,
    "supplier_name": null
  },
  {
    "asset_type": "ELECTRICAL",
    "name": "1 Ton Onida",
    "quantity": 5,
    "branch_id": 1,
    "location": "J. Hills",
    "serial_number": "IDU-N17LA400061                   \nODU-17LA4000288",
    "ams_barcode": "ElACTS0006",
    "po_number": "22",
    "po_date": "2018-06-06",
    "invoice_date": null,
    "purchase_value": 31904.0,
    "current_status": "Working",
    "remarks": null,
    "supplier_name": "MAHA Shakti Traders"
  },
  {
    "asset_type": "ELECTRICAL",
    "name": "15 Ton PAC Stulz",
    "quantity": 1,
    "branch_id": 1,
    "location": "J. Hills",
    "serial_number": "Idu:10016449,\nOdu:5191569",
    "ams_barcode": "ACPA150001",
    "po_number": "Po.No. 04, Dt: 05-04-2019",
    "po_date": "2019-04-05",
    "invoice_date": null,
    "purchase_value": 954719.0,
    "current_status": "Working",
    "remarks": null,
    "supplier_name": "Prasa Infocom & Power Solutions Pvt Ltd"
  },
  {
    "asset_type": "ELECTRICAL",
    "name": "1 Ton Voltas",
    "quantity": 3,
    "branch_id": 1,
    "location": "Cyber Tower",
    "serial_number": "4552593B20AC05823",
    "ams_barcode": "AC1TVA0001",
    "po_number": "Po No.29  dt: 04-09-2020",
    "po_date": "2020-09-04",
    "invoice_date": null,
    "purchase_value": 36460.0,
    "current_status": "Working",
    "remarks": null,
    "supplier_name": "MEGASTAR ELECTRONICS,78,Hall Bazar,"
  },
  {
    "asset_type": "ELECTRICAL",
    "name": "2 Ton Hitachi",
    "quantity": 1,
    "branch_id": 1,
    "location": "J. Hills",
    "serial_number": "1908B60713",
    "ams_barcode": "ElAC2T0009",
    "po_number": "Po No.30  dt: 04-09-2020",
    "po_date": "2020-09-04",
    "invoice_date": null,
    "purchase_value": 47999.0,
    "current_status": "Working",
    "remarks": null,
    "supplier_name": "Mangalam Stores"
  },
  {
    "asset_type": "ELECTRICAL",
    "name": "2 Ton Carrier",
    "quantity": 1,
    "branch_id": 1,
    "location": "J Hills",
    "serial_number": "2AXO-SLV-1321",
    "ams_barcode": "ACCA2T0016",
    "po_number": "PO No.57, 23.09.1998",
    "po_date": null,
    "invoice_date": null,
    "purchase_value": 36500.0,
    "current_status": "Working",
    "remarks": "Obsolete",
    "supplier_name": "Carrior aircon ltd"
  },
  {
    "asset_type": "ELECTRICAL",
    "name": "Erico TSG 1130-2S",
    "quantity": 1,
    "branch_id": 1,
    "location": "J. Hills",
    "serial_number": "TSG 1130-2S",
    "ams_barcode": null,
    "po_number": "2010",
    "po_date": null,
    "invoice_date": null,
    "purchase_value": 35150.0,
    "current_status": "Working",
    "remarks": null,
    "supplier_name": null
  },
  {
    "asset_type": "ELECTRICAL",
    "name": "AMF Electrical  Pannels",
    "quantity": 2,
    "branch_id": 1,
    "location": "J. Hills",
    "serial_number": "2765684-AMF-1",
    "ams_barcode": "ElAPAL0005",
    "po_number": "Po No. 17, Dt : 14-09-2010",
    "po_date": "2010-09-14",
    "invoice_date": null,
    "purchase_value": 336960.0,
    "current_status": "Working",
    "remarks": null,
    "supplier_name": "M/s Ahuja Engineering Services P Ltd"
  },
  {
    "asset_type": "ELECTRICAL",
    "name": "AMF Electrical  Pannels",
    "quantity": 1,
    "branch_id": 1,
    "location": "J. Hills",
    "serial_number": "2765762-AMF2",
    "ams_barcode": "ElAPAL0006",
    "po_number": null,
    "po_date": null,
    "invoice_date": null,
    "purchase_value": null,
    "current_status": "Working",
    "remarks": null,
    "supplier_name": null
  },
  {
    "asset_type": "ELECTRICAL",
    "name": "20KVA UPS",
    "quantity": 2,
    "branch_id": 1,
    "location": "Cyber Tower",
    "serial_number": "II101110120",
    "ams_barcode": "ElUPUP0015",
    "po_number": "Po No. 64 dt: 02-01-2011",
    "po_date": "2011-01-02",
    "invoice_date": null,
    "purchase_value": 198596.0,
    "current_status": "Working",
    "remarks": null,
    "supplier_name": "Numeric power systems"
  },
  {
    "asset_type": "ELECTRICAL",
    "name": "20KVA UPS",
    "quantity": 1,
    "branch_id": 1,
    "location": "Cyber Tower",
    "serial_number": "II101110121",
    "ams_barcode": "ElUPUP0016",
    "po_number": null,
    "po_date": null,
    "invoice_date": null,
    "purchase_value": 198596.0,
    "current_status": "Working",
    "remarks": null,
    "supplier_name": null
  },
  {
    "asset_type": "ELECTRICAL",
    "name": "APC ATS AP7722A",
    "quantity": 1,
    "branch_id": 1,
    "location": "J. Hills",
    "serial_number": "5A1341T01763/541430T13598",
    "ams_barcode": "EQATAP0001",
    "po_number": "Po No.48 Dat: 13-11-2014",
    "po_date": "2014-11-13",
    "invoice_date": null,
    "purchase_value": 54387.0,
    "current_status": "Working",
    "remarks": "Not In use",
    "supplier_name": "Access Power Care Systems"
  },
  {
    "asset_type": "ELECTRICAL",
    "name": "APC IPDU",
    "quantity": 1,
    "branch_id": 1,
    "location": "J. Hills",
    "serial_number": "ZA1240001827",
    "ams_barcode": "EQPDDU0002",
    "po_number": "Po No.37 Dat: 10-11-2013",
    "po_date": "2013-11-10",
    "invoice_date": null,
    "purchase_value": 93627.0,
    "current_status": "Working",
    "remarks": null,
    "supplier_name": "APW president Systems Ltd"
  },
  {
    "asset_type": "ELECTRICAL",
    "name": "APC IPDU",
    "quantity": 8,
    "branch_id": 1,
    "location": "J. Hills",
    "serial_number": "5A1636E05285",
    "ams_barcode": "ElDURU0001",
    "po_number": "Po No.42 Dat:11-01-2016",
    "po_date": "2016-01-11",
    "invoice_date": null,
    "purchase_value": 571627.0,
    "current_status": "Working",
    "remarks": null,
    "supplier_name": "Access Power Care Systems"
  },
  {
    "asset_type": "ELECTRICAL",
    "name": "APC IPDU",
    "quantity": 1,
    "branch_id": 1,
    "location": "J. Hills",
    "serial_number": "5A1636E05286",
    "ams_barcode": "ElDURU0002",
    "po_number": null,
    "po_date": null,
    "invoice_date": null,
    "purchase_value": null,
    "current_status": "Working",
    "remarks": null,
    "supplier_name": null
  },
  {
    "asset_type": "ELECTRICAL",
    "name": "APC IPDU",
    "quantity": 1,
    "branch_id": 1,
    "location": "J. Hills",
    "serial_number": "5A1636E05294",
    "ams_barcode": "ElDURU0003",
    "po_number": null,
    "po_date": null,
    "invoice_date": null,
    "purchase_value": null,
    "current_status": "Working",
    "remarks": null,
    "supplier_name": null
  },
  {
    "asset_type": "ELECTRICAL",
    "name": "APC IPDU",
    "quantity": 1,
    "branch_id": 1,
    "location": "Image",
    "serial_number": "5A1636E05295",
    "ams_barcode": "ElDURU0004",
    "po_number": null,
    "po_date": null,
    "invoice_date": null,
    "purchase_value": null,
    "current_status": "Working",
    "remarks": null,
    "supplier_name": null
  },
  {
    "asset_type": "ELECTRICAL",
    "name": "APC IPDU",
    "quantity": 1,
    "branch_id": 1,
    "location": "J. Hills",
    "serial_number": "ZA1631180194",
    "ams_barcode": "ElDURU0005",
    "po_number": null,
    "po_date": null,
    "invoice_date": null,
    "purchase_value": null,
    "current_status": "Working",
    "remarks": null,
    "supplier_name": null
  },
  {
    "asset_type": "ELECTRICAL",
    "name": "APC IPDU",
    "quantity": 1,
    "branch_id": 1,
    "location": "J. Hills",
    "serial_number": "ZA1631180196",
    "ams_barcode": "ElDURU0006",
    "po_number": null,
    "po_date": null,
    "invoice_date": null,
    "purchase_value": null,
    "current_status": "Working",
    "remarks": null,
    "supplier_name": null
  },
  {
    "asset_type": "ELECTRICAL",
    "name": "APC IPDU",
    "quantity": 1,
    "branch_id": 1,
    "location": "J. Hills",
    "serial_number": "ZA1631180204",
    "ams_barcode": "ElDURU0007",
    "po_number": null,
    "po_date": null,
    "invoice_date": null,
    "purchase_value": null,
    "current_status": "Working",
    "remarks": null,
    "supplier_name": null
  },
  {
    "asset_type": "ELECTRICAL",
    "name": "APC IPDU",
    "quantity": 1,
    "branch_id": 1,
    "location": "Image",
    "serial_number": "ZA1631180209",
    "ams_barcode": "ElDURU0008",
    "po_number": null,
    "po_date": null,
    "invoice_date": null,
    "purchase_value": null,
    "current_status": "Working",
    "remarks": null,
    "supplier_name": null
  },
  {
    "asset_type": "ELECTRICAL",
    "name": "100KVA Delta UPS System",
    "quantity": 1,
    "branch_id": 1,
    "location": "J. Hills",
    "serial_number": "E21315C00184R2",
    "ams_barcode": "ElUP1H0001",
    "po_number": "Po No. 38, Dt: 21-12-2015",
    "po_date": "2015-12-21",
    "invoice_date": null,
    "purchase_value": 797343.0,
    "current_status": "Working",
    "remarks": null,
    "supplier_name": "Delta power solutions india pvt ltd"
  },
  {
    "asset_type": "ELECTRICAL",
    "name": "3 KVA UPS system",
    "quantity": 1,
    "branch_id": 1,
    "location": "J Hills",
    "serial_number": "82107600069WL",
    "ams_barcode": "ElUPUP0009",
    "po_number": "PO No. 77, 21.09.2007",
    "po_date": null,
    "invoice_date": null,
    "purchase_value": 48000.0,
    "current_status": "Working",
    "remarks": "Use as back up on emergency",
    "supplier_name": "APS Technologies"
  },
  {
    "asset_type": "ELECTRICAL",
    "name": "2X80KVA Emerson UPS",
    "quantity": 2,
    "branch_id": 1,
    "location": "Image",
    "serial_number": "201405HX0379",
    "ams_barcode": "ElUPUP0019",
    "po_number": "2016",
    "po_date": null,
    "invoice_date": null,
    "purchase_value": 2706628.5,
    "current_status": "Working",
    "remarks": null,
    "supplier_name": "TSIIC"
  },
  {
    "asset_type": "ELECTRICAL",
    "name": "5KVA Inverter",
    "quantity": 1,
    "branch_id": 1,
    "location": "Image",
    "serial_number": "RVF000041",
    "ams_barcode": "ElUPUP0018",
    "po_number": "2016",
    "po_date": null,
    "invoice_date": null,
    "purchase_value": 113850.0,
    "current_status": "Working",
    "remarks": null,
    "supplier_name": "TSIIC"
  },
  {
    "asset_type": "ELECTRICAL",
    "name": "VAV 1500 CFM",
    "quantity": 49,
    "branch_id": 1,
    "location": "Image",
    "serial_number": null,
    "ams_barcode": "VSVAVV0001\nVSVAVV0002\nVSVAVV0003\nVSVAVV0004",
    "po_number": "2016",
    "po_date": null,
    "invoice_date": null,
    "purchase_value": 1050000.0,
    "current_status": "Working",
    "remarks": null,
    "supplier_name": "TSIIC"
  },
  {
    "asset_type": "ELECTRICAL",
    "name": "VAV 2000 CFM",
    "quantity": 1,
    "branch_id": 1,
    "location": "Image",
    "serial_number": null,
    "ams_barcode": "VSVAVV0005\nVSVAVV0006\nVSVAVV0007\nVSVAVV0008\nVSVAVV0009",
    "po_number": null,
    "po_date": null,
    "invoice_date": null,
    "purchase_value": null,
    "current_status": "Working",
    "remarks": null,
    "supplier_name": null
  },
  {
    "asset_type": "ELECTRICAL",
    "name": "VAV 2500 CFM",
    "quantity": 1,
    "branch_id": 1,
    "location": "Image",
    "serial_number": null,
    "ams_barcode": "VSVVVA0001\nVSVVVA0002\nVSVVVA0003",
    "po_number": null,
    "po_date": null,
    "invoice_date": null,
    "purchase_value": null,
    "current_status": "Working",
    "remarks": null,
    "supplier_name": null
  },
  {
    "asset_type": "ELECTRICAL",
    "name": "VAV 3000 CFM",
    "quantity": 1,
    "branch_id": 1,
    "location": "Image",
    "serial_number": null,
    "ams_barcode": "VSVAVV0010\nVSVAVV0011\nVSVAVV0012\nVSVAVV0013",
    "po_number": null,
    "po_date": null,
    "invoice_date": null,
    "purchase_value": null,
    "current_status": "Working",
    "remarks": null,
    "supplier_name": null
  },
  {
    "asset_type": "ELECTRICAL",
    "name": "VAV 900 CFM",
    "quantity": 1,
    "branch_id": 1,
    "location": "Image",
    "serial_number": null,
    "ams_barcode": "VSVAVV0015\nVSVAVV0016\nVSVAVV0017",
    "po_number": null,
    "po_date": null,
    "invoice_date": null,
    "purchase_value": null,
    "current_status": "Working",
    "remarks": null,
    "supplier_name": null
  },
  {
    "asset_type": "ELECTRICAL",
    "name": "VAV 650 CFM",
    "quantity": 1,
    "branch_id": 1,
    "location": "Image",
    "serial_number": null,
    "ams_barcode": "VSVAVV0018",
    "po_number": null,
    "po_date": null,
    "invoice_date": null,
    "purchase_value": null,
    "current_status": "Working",
    "remarks": null,
    "supplier_name": null
  },
  {
    "asset_type": "ELECTRICAL",
    "name": "VAV 800 CFM",
    "quantity": 1,
    "branch_id": 1,
    "location": "Image",
    "serial_number": null,
    "ams_barcode": "VSVAVV0014",
    "po_number": null,
    "po_date": null,
    "invoice_date": null,
    "purchase_value": null,
    "current_status": "Working",
    "remarks": null,
    "supplier_name": null
  },
  {
    "asset_type": "ELECTRICAL",
    "name": "350 CFM VAV BOX",
    "quantity": 10,
    "branch_id": 1,
    "location": "Image",
    "serial_number": null,
    "ams_barcode": "VSVACF0001\nVSVACF0002\nVSVACF0003\nVSVACF0004\nVSVACF0005\nVSVACF0006\nVSVACF0007\nVSVACF0008\nVSVACF0009\nVSVACF0010",
    "po_number": "2017",
    "po_date": null,
    "invoice_date": null,
    "purchase_value": 270000.0,
    "current_status": "Working",
    "remarks": null,
    "supplier_name": "NPCC"
  },
  {
    "asset_type": "ELECTRICAL",
    "name": "450 CFM VAV BOX",
    "quantity": 3,
    "branch_id": 1,
    "location": "Image",
    "serial_number": null,
    "ams_barcode": "VSCFCM0001\nVSCFCM0002\nVSCFCM0003",
    "po_number": null,
    "po_date": null,
    "invoice_date": null,
    "purchase_value": 81000.0,
    "current_status": "Working",
    "remarks": null,
    "supplier_name": null
  },
  {
    "asset_type": "ELECTRICAL",
    "name": "650 CFM VAV BOX",
    "quantity": 9,
    "branch_id": 1,
    "location": "Image",
    "serial_number": null,
    "ams_barcode": "VSCMCF0001\nVSCMCF0002\nVSCMCF0003\nVSCMCF0004\nVSCMCF0005\nVSCMCF0006\nVSCMCF0007\nVSCMCF0008\nVSCMCF0009",
    "po_number": null,
    "po_date": null,
    "invoice_date": null,
    "purchase_value": 243000.0,
    "current_status": "Working",
    "remarks": null,
    "supplier_name": null
  },
  {
    "asset_type": "ELECTRICAL",
    "name": "800 CFM VAV BOX",
    "quantity": 1,
    "branch_id": 1,
    "location": "Image",
    "serial_number": null,
    "ams_barcode": "VScfcm0004",
    "po_number": null,
    "po_date": null,
    "invoice_date": null,
    "purchase_value": 28500.0,
    "current_status": "Working",
    "remarks": null,
    "supplier_name": null
  },
  {
    "asset_type": "ELECTRICAL",
    "name": "1050 CFM VAV BOX",
    "quantity": 1,
    "branch_id": 1,
    "location": "Image",
    "serial_number": null,
    "ams_barcode": "VSCFCM0005",
    "po_number": null,
    "po_date": null,
    "invoice_date": null,
    "purchase_value": 28500.0,
    "current_status": "Working",
    "remarks": null,
    "supplier_name": null
  },
  {
    "asset_type": "ELECTRICAL",
    "name": "1350 CFM VAV BOX",
    "quantity": 2,
    "branch_id": 1,
    "location": "Image",
    "serial_number": null,
    "ams_barcode": "VSCFCM0006",
    "po_number": null,
    "po_date": null,
    "invoice_date": null,
    "purchase_value": 29500.0,
    "current_status": "Working",
    "remarks": null,
    "supplier_name": null
  },
  {
    "asset_type": "ELECTRICAL",
    "name": "Spectra",
    "quantity": 3,
    "branch_id": 1,
    "location": "Image",
    "serial_number": 12155465,
    "ams_barcode": "ACGTEM0004",
    "po_number": "2016",
    "po_date": null,
    "invoice_date": null,
    "purchase_value": 281075.0,
    "current_status": "Working",
    "remarks": null,
    "supplier_name": "TSIIC"
  },
  {
    "asset_type": "ELECTRICAL",
    "name": "Phillips  06 Watts ceiling speakers",
    "quantity": 99,
    "branch_id": 1,
    "location": "Image",
    "serial_number": null,
    "ams_barcode": "SPSPSP0001",
    "po_number": "2016",
    "po_date": null,
    "invoice_date": null,
    "purchase_value": 92466.0,
    "current_status": "Working",
    "remarks": null,
    "supplier_name": "TSIIC"
  },
  {
    "asset_type": "ELECTRICAL",
    "name": "Bosch Amplifier System",
    "quantity": 2,
    "branch_id": 1,
    "location": "Image",
    "serial_number": null,
    "ams_barcode": "BABOBS0001\nBABOBS0002",
    "po_number": "2016",
    "po_date": null,
    "invoice_date": null,
    "purchase_value": 157320.0,
    "current_status": "Working",
    "remarks": null,
    "supplier_name": "TSIIC"
  },
  {
    "asset_type": "ELECTRICAL",
    "name": "Supervisory Controller for HAVC",
    "quantity": 2,
    "branch_id": 1,
    "location": "Image",
    "serial_number": "IVRFTDV6800347",
    "ams_barcode": "EIEIEI0029",
    "po_number": "2016",
    "po_date": null,
    "invoice_date": null,
    "purchase_value": null,
    "current_status": "Working",
    "remarks": null,
    "supplier_name": "TSIIC"
  },
  {
    "asset_type": "ELECTRICAL",
    "name": "Honeywell 16CH DVR",
    "quantity": 1,
    "branch_id": 1,
    "location": "Image",
    "serial_number": "HADVR121615123036",
    "ams_barcode": "CMCACM0003",
    "po_number": "2016",
    "po_date": null,
    "invoice_date": null,
    "purchase_value": 15576.75,
    "current_status": "Working",
    "remarks": null,
    "supplier_name": "TSIIC"
  },
  {
    "asset_type": "ELECTRICAL",
    "name": "Honeywell Indoor Camera",
    "quantity": 15,
    "branch_id": 1,
    "location": "Image",
    "serial_number": "B1410300102",
    "ams_barcode": "SECCCC0007",
    "po_number": "2016",
    "po_date": null,
    "invoice_date": null,
    "purchase_value": 111780.0,
    "current_status": "Working",
    "remarks": null,
    "supplier_name": "TSIIC"
  },
  {
    "asset_type": "ELECTRICAL",
    "name": "HCL Indoor camera",
    "quantity": 1,
    "branch_id": 1,
    "location": "Image",
    "serial_number": "000E530DF031",
    "ams_barcode": "SEccCC0006",
    "po_number": "PO no.93,dt 29.01.2009",
    "po_date": null,
    "invoice_date": null,
    "purchase_value": 17069.38,
    "current_status": "Working",
    "remarks": null,
    "supplier_name": "HCL"
  },
  {
    "asset_type": "ELECTRICAL",
    "name": "Axis Indoor Camera",
    "quantity": 12,
    "branch_id": 1,
    "location": "Image",
    "serial_number": "ACCC8E841258",
    "ams_barcode": "CMACAI0001",
    "po_number": "2017",
    "po_date": null,
    "invoice_date": null,
    "purchase_value": 414000.0,
    "current_status": "Working",
    "remarks": null,
    "supplier_name": "NPCC"
  },
  {
    "asset_type": "ELECTRICAL",
    "name": "8CH NVR",
    "quantity": 2,
    "branch_id": 1,
    "location": "Image",
    "serial_number": "NS-2080-CY0-704100009",
    "ams_barcode": "CMCACM0001",
    "po_number": null,
    "po_date": null,
    "invoice_date": null,
    "purchase_value": null,
    "current_status": "Working",
    "remarks": null,
    "supplier_name": null
  },
  {
    "asset_type": "ELECTRICAL",
    "name": "Hikvison Indoor camera",
    "quantity": 9,
    "branch_id": 1,
    "location": "J. Hills",
    "serial_number": "F99144058",
    "ams_barcode": "CMHIHI0001",
    "po_number": "work order no.  06/2021-22  dt: 26-07-2021",
    "po_date": "2021-07-26",
    "invoice_date": null,
    "purchase_value": 390640.0,
    "current_status": "Working",
    "remarks": null,
    "supplier_name": "M/s Sreetrinethra security systems"
  },
  {
    "asset_type": "ELECTRICAL",
    "name": "Hikvison Outdoor camera",
    "quantity": 4,
    "branch_id": 1,
    "location": "Cyber Tower",
    "serial_number": "G76376784",
    "ams_barcode": "CMHIHI0006",
    "po_number": null,
    "po_date": null,
    "invoice_date": null,
    "purchase_value": null,
    "current_status": "Working",
    "remarks": null,
    "supplier_name": null
  },
  {
    "asset_type": "ELECTRICAL",
    "name": "Hikvison 16Ch 48TB NVR",
    "quantity": 2,
    "branch_id": 1,
    "location": "J. Hills",
    "serial_number": "G55368734",
    "ams_barcode": "HNNCMH0001",
    "po_number": null,
    "po_date": null,
    "invoice_date": null,
    "purchase_value": null,
    "current_status": "Working",
    "remarks": null,
    "supplier_name": null
  },
  {
    "asset_type": "ELECTRICAL",
    "name": "Hikvison PoE Switches",
    "quantity": 2,
    "branch_id": 1,
    "location": "J. Hills",
    "serial_number": "G249038240",
    "ams_barcode": "HSHPHK0001",
    "po_number": null,
    "po_date": null,
    "invoice_date": null,
    "purchase_value": null,
    "current_status": "Working",
    "remarks": null,
    "supplier_name": null
  },
  {
    "asset_type": "ELECTRICAL",
    "name": "PoE Switch D Link",
    "quantity": 2,
    "branch_id": 1,
    "location": "Image",
    "serial_number": "QS8C1H3001217",
    "ams_barcode": "STSWDL0002",
    "po_number": "2017",
    "po_date": null,
    "invoice_date": null,
    "purchase_value": 43200.0,
    "current_status": "Working",
    "remarks": null,
    "supplier_name": "TSIIC"
  },
  {
    "asset_type": "ELECTRICAL",
    "name": "Ahuja  Amplifier System",
    "quantity": 2,
    "branch_id": 1,
    "location": "Image",
    "serial_number": 4357021,
    "ams_barcode": "AAAAAE0002",
    "po_number": "2017",
    "po_date": null,
    "invoice_date": null,
    "purchase_value": 170000.0,
    "current_status": "Working",
    "remarks": null,
    "supplier_name": "NPCC"
  },
  {
    "asset_type": "ELECTRICAL",
    "name": "Ahuja  Zone Selector",
    "quantity": 2,
    "branch_id": 1,
    "location": "Image",
    "serial_number": 7206483,
    "ams_barcode": "AZAHAJ0002",
    "po_number": "2017",
    "po_date": null,
    "invoice_date": null,
    "purchase_value": 33000.0,
    "current_status": "Working",
    "remarks": null,
    "supplier_name": "NPCC"
  },
  {
    "asset_type": "ELECTRICAL",
    "name": "Bosch 06 Watts ceiling speakers",
    "quantity": 96,
    "branch_id": 1,
    "location": "Image",
    "serial_number": null,
    "ams_barcode": "ElBWBO0001",
    "po_number": "2017",
    "po_date": null,
    "invoice_date": null,
    "purchase_value": 139408.69565217395,
    "current_status": "Working",
    "remarks": null,
    "supplier_name": "TSIIC"
  },
  {
    "asset_type": "ELECTRICAL",
    "name": "Thermostat",
    "quantity": 26,
    "branch_id": 1,
    "location": "Image",
    "serial_number": null,
    "ams_barcode": "STSWTE0001",
    "po_number": "2017",
    "po_date": null,
    "invoice_date": null,
    "purchase_value": 156000.0,
    "current_status": "Working",
    "remarks": null,
    "supplier_name": "NPCC"
  },
  {
    "asset_type": "ELECTRICAL",
    "name": "Actuators",
    "quantity": 4,
    "branch_id": 1,
    "location": "Image",
    "serial_number": "01,02, 03 04",
    "ams_barcode": "ACASSA0001 \nACASSA0002\nACASSA0003\nACASSA0004",
    "po_number": "2017",
    "po_date": null,
    "invoice_date": null,
    "purchase_value": 74000.0,
    "current_status": "Working",
    "remarks": null,
    "supplier_name": "NPCC"
  },
  {
    "asset_type": "ELECTRICAL",
    "name": "ESSL access control",
    "quantity": 4,
    "branch_id": 1,
    "location": "Image",
    "serial_number": "OIN704012704200012 7",
    "ams_barcode": "ACGTAR0066",
    "po_number": "2017",
    "po_date": null,
    "invoice_date": null,
    "purchase_value": 788705.0,
    "current_status": "Working",
    "remarks": null,
    "supplier_name": "NPCC"
  },
  {
    "asset_type": "ELECTRICAL",
    "name": "MAIN LT PANEL-1",
    "quantity": 1,
    "branch_id": 1,
    "location": "Image",
    "serial_number": null,
    "ams_barcode": "EIEIEI0038",
    "po_number": "2017",
    "po_date": null,
    "invoice_date": null,
    "purchase_value": 235463.0,
    "current_status": "Working",
    "remarks": null,
    "supplier_name": "NPCC"
  },
  {
    "asset_type": "ELECTRICAL",
    "name": "MAIN LT PANEL-2",
    "quantity": 1,
    "branch_id": 1,
    "location": "Image",
    "serial_number": null,
    "ams_barcode": "EQECED0008",
    "po_number": null,
    "po_date": null,
    "invoice_date": null,
    "purchase_value": 213210.0,
    "current_status": "Working",
    "remarks": null,
    "supplier_name": "NPCC"
  },
  {
    "asset_type": "ELECTRICAL",
    "name": "20HP",
    "quantity": 1,
    "branch_id": 1,
    "location": "Image",
    "serial_number": "IVRFB-20TC17F00023",
    "ams_barcode": "EQELEL0001",
    "po_number": "2017",
    "po_date": null,
    "invoice_date": null,
    "purchase_value": 712639.95,
    "current_status": "Working",
    "remarks": null,
    "supplier_name": "NPCC"
  },
  {
    "asset_type": "ELECTRICAL",
    "name": "16HP",
    "quantity": 1,
    "branch_id": 1,
    "location": "Image",
    "serial_number": "IVRFB-16TC17F00051",
    "ams_barcode": "EQELEL0002",
    "po_number": "2017",
    "po_date": null,
    "invoice_date": null,
    "purchase_value": 648493.0,
    "current_status": "Working",
    "remarks": null,
    "supplier_name": "NPCC"
  },
  {
    "asset_type": "ELECTRICAL",
    "name": "Access control PC Server with software",
    "quantity": 1,
    "branch_id": 1,
    "location": "Image",
    "serial_number": null,
    "ams_barcode": "ACGTAR0065",
    "po_number": "41",
    "po_date": "2017-11-09",
    "invoice_date": null,
    "purchase_value": 112450.0,
    "current_status": "Working",
    "remarks": null,
    "supplier_name": "NPCC"
  },
  {
    "asset_type": "ELECTRICAL",
    "name": "eSSL x990 Biometric",
    "quantity": 2,
    "branch_id": 1,
    "location": "Image",
    "serial_number": "OIN7060057062000514",
    "ams_barcode": "ACBIEX0001",
    "po_number": "41",
    "po_date": null,
    "invoice_date": null,
    "purchase_value": 25000.0,
    "current_status": "Working",
    "remarks": null,
    "supplier_name": "M/s. Airtech System"
  },
  {
    "asset_type": "ELECTRICAL",
    "name": "Biomax 3000",
    "quantity": 3,
    "branch_id": 1,
    "location": "Cyber Tower",
    "serial_number": "84EOF42C5E8DAA01",
    "ams_barcode": "BAFBFR0001",
    "po_number": "GEMC-511687764411833, dt 04-07-2022",
    "po_date": "2022-07-04",
    "invoice_date": null,
    "purchase_value": 24350.0,
    "current_status": "Working",
    "remarks": null,
    "supplier_name": "RHYTHM Technologies"
  },
  {
    "asset_type": "ELECTRICAL",
    "name": "60KVA BPE UPS System",
    "quantity": 1,
    "branch_id": 1,
    "location": "J. Hills",
    "serial_number": "R12M21G00006",
    "ams_barcode": "UPKVSR0001",
    "po_number": "GEMC-511687767944400,Dt: 14-03-2022",
    "po_date": "2022-03-14",
    "invoice_date": null,
    "purchase_value": 603629.0,
    "current_status": "Working",
    "remarks": null,
    "supplier_name": "RAJ POWER TECH SERVICES"
  },
  {
    "asset_type": "ELECTRICAL",
    "name": "Rariton IPDU",
    "quantity": 6,
    "branch_id": 1,
    "location": "J. Hills",
    "serial_number": "QYH3500085,QYH3500115,\nQYH3500114,QYH3500067,\n QYH3500059,QYH3500072",
    "ams_barcode": "IPIPIP0001\nIPIPIP0002 \nIPIPIP0003\nIPIPIP0004\nIPIPIP0005 IPIPIP0006",
    "po_number": "GEMC-511687792011453  dated: 27/10/2023",
    "po_date": "2023-10-27",
    "invoice_date": null,
    "purchase_value": 461400.0,
    "current_status": "Working",
    "remarks": null,
    "supplier_name": "BAHETI TECH SOLUTIONS PRIVATE LIMITED"
  },
  {
    "asset_type": "ELECTRICAL",
    "name": "48 Volts /5A Power Supply",
    "quantity": 1,
    "branch_id": 1,
    "location": "J Hills",
    "serial_number": "20010760, PS23",
    "ams_barcode": "FXEIPS0001",
    "po_number": "P O -187 Dt 23.01.2002",
    "po_date": null,
    "invoice_date": null,
    "purchase_value": 21000.0,
    "current_status": "Working",
    "remarks": null,
    "supplier_name": "Mectron Electronics"
  },
  {
    "asset_type": "ELECTRICAL",
    "name": "48 Volts /15A Power Supply",
    "quantity": 1,
    "branch_id": 1,
    "location": "J Hills",
    "serial_number": "NA, PS 24",
    "ams_barcode": "FXEIPS0004",
    "po_number": "6.03.1995",
    "po_date": null,
    "invoice_date": null,
    "purchase_value": 14438.0,
    "current_status": "Working",
    "remarks": null,
    "supplier_name": "Kavali Elecronics"
  },
  {
    "asset_type": "ELECTRICAL",
    "name": "UPS  0.6KVA",
    "quantity": 1,
    "branch_id": 1,
    "location": "J Hills",
    "serial_number": 1900520000402,
    "ams_barcode": "UPUPUS0001",
    "po_number": null,
    "po_date": null,
    "invoice_date": null,
    "purchase_value": 1850.0,
    "current_status": "Working",
    "remarks": null,
    "supplier_name": null
  },
  {
    "asset_type": "ELECTRICAL",
    "name": "Voltas",
    "quantity": 1,
    "branch_id": 1,
    "location": "cyber towers",
    "serial_number": "4513517D241A23659, 455467C24JC08218",
    "ams_barcode": "AC1TVA0005",
    "po_number": "GEMC-511687798510505,\nDate : 17-Dec-2024",
    "po_date": null,
    "invoice_date": null,
    "purchase_value": 30868.0,
    "current_status": "Working",
    "remarks": null,
    "supplier_name": "M/s. Video Center"
  },
  {
    "asset_type": "OFFICE",
    "name": "Wall Mounting Fan",
    "quantity": 1,
    "branch_id": 1,
    "location": "J Hills",
    "serial_number": null,
    "ams_barcode": "FNWFWF0007",
    "po_number": "PO 18 Dt 26.06.2014",
    "po_date": null,
    "invoice_date": null,
    "purchase_value": 1715.0,
    "current_status": "Working",
    "remarks": null,
    "supplier_name": "Kendiya Bandar"
  },
  {
    "asset_type": "OFFICE",
    "name": "Wall Mounting Fan",
    "quantity": 1,
    "branch_id": 1,
    "location": "J Hills",
    "serial_number": null,
    "ams_barcode": "FNWFWF0008",
    "po_number": "P o -18 Dt 26.06.2014",
    "po_date": null,
    "invoice_date": null,
    "purchase_value": 1715.0,
    "current_status": "Working",
    "remarks": null,
    "supplier_name": "Kendiya Bandar"
  },
  {
    "asset_type": "OFFICE",
    "name": "Exhaut fan",
    "quantity": 2,
    "branch_id": 1,
    "location": "J Hills",
    "serial_number": null,
    "ams_barcode": "FNWFHF0013",
    "po_number": null,
    "po_date": null,
    "invoice_date": null,
    "purchase_value": 2330.0,
    "current_status": "Working",
    "remarks": null,
    "supplier_name": null
  },
  {
    "asset_type": "OFFICE",
    "name": "Exhaut fan",
    "quantity": 1,
    "branch_id": 1,
    "location": null,
    "serial_number": "S301112272951",
    "ams_barcode": "FFFFEF0008",
    "po_number": null,
    "po_date": null,
    "invoice_date": null,
    "purchase_value": 1640.0,
    "current_status": "Working",
    "remarks": null,
    "supplier_name": "Surya Home applience"
  },
  {
    "asset_type": "OFFICE",
    "name": "Laser Tester",
    "quantity": 1,
    "branch_id": 1,
    "location": "J Hills",
    "serial_number": null,
    "ams_barcode": "FFFFEF0012",
    "po_number": "4.05.2022",
    "po_date": null,
    "invoice_date": null,
    "purchase_value": 999.0,
    "current_status": "Working",
    "remarks": null,
    "supplier_name": "Amazon"
  },
  {
    "asset_type": "OFFICE",
    "name": "GPS",
    "quantity": 1,
    "branch_id": 1,
    "location": "J Hills",
    "serial_number": 254019609,
    "ams_barcode": "GMGPGS0002",
    "po_number": "PO  47\nDt 12/03/2012",
    "po_date": "2012-03-12",
    "invoice_date": null,
    "purchase_value": 6490.0,
    "current_status": "Working",
    "remarks": null,
    "supplier_name": "Futhune Meda Hyderabad"
  },
  {
    "asset_type": "OFFICE",
    "name": "Digital earth tester Waco",
    "quantity": 2,
    "branch_id": 1,
    "location": "J Hills",
    "serial_number": null,
    "ams_barcode": "ERDTMM0001",
    "po_number": "GEMC-511687717225957 Dt 25-Aug-2021",
    "po_date": null,
    "invoice_date": null,
    "purchase_value": 7545.99,
    "current_status": "Working",
    "remarks": null,
    "supplier_name": "Batra Electronics"
  },
  {
    "asset_type": "OFFICE",
    "name": "Dancing Spring Back ( Sprayer)",
    "quantity": 1,
    "branch_id": 1,
    "location": "J Hills",
    "serial_number": null,
    "ams_barcode": "PFBFPB0034",
    "po_number": "28.04.2021",
    "po_date": null,
    "invoice_date": null,
    "purchase_value": 1800.0,
    "current_status": "Working",
    "remarks": null,
    "supplier_name": "Shaha Enterprises"
  },
  {
    "asset_type": "OFFICE",
    "name": "Drilling Machine",
    "quantity": 1,
    "branch_id": 1,
    "location": "J Hills",
    "serial_number": 28022883,
    "ams_barcode": "DMhdDR0001",
    "po_number": "P.O-51,  Dt.-11-23-2020",
    "po_date": null,
    "invoice_date": null,
    "purchase_value": 8050.85,
    "current_status": "Working",
    "remarks": null,
    "supplier_name": null
  },
  {
    "asset_type": "OFFICE",
    "name": "Peadastal fans crampton",
    "quantity": 2,
    "branch_id": 1,
    "location": "J Hills",
    "serial_number": "LSBK2WJ012124",
    "ams_barcode": "PFPFPF0001",
    "po_number": "Gem -511687740508372, Dt.-12.08.2023",
    "po_date": null,
    "invoice_date": null,
    "purchase_value": 5042.37,
    "current_status": "Working",
    "remarks": null,
    "supplier_name": "Maheswari Technologies"
  },
  {
    "asset_type": "OFFICE",
    "name": "Peadastal fans Bajaj",
    "quantity": 1,
    "branch_id": 1,
    "location": "Image",
    "serial_number": null,
    "ams_barcode": "PFBFPB0002",
    "po_number": "GEMC-511687703697028,\nDt.- 07.06.2023",
    "po_date": null,
    "invoice_date": null,
    "purchase_value": 3299.0,
    "current_status": "Working",
    "remarks": null,
    "supplier_name": "Maheswari Technologies"
  },
  {
    "asset_type": "OFFICE",
    "name": "NEC- LCD TV- 50''",
    "quantity": 1,
    "branch_id": 1,
    "location": "J Hills",
    "serial_number": null,
    "ams_barcode": "ASPSPX0002",
    "po_number": "PO N. 58, dt 29.09.2006",
    "po_date": null,
    "invoice_date": null,
    "purchase_value": 206985.0,
    "current_status": "Working",
    "remarks": "Obsolute",
    "supplier_name": "NEC Solutions"
  },
  {
    "asset_type": "OFFICE",
    "name": "Bluestar water despensor",
    "quantity": 2,
    "branch_id": 1,
    "location": "J Hills",
    "serial_number": "HV36LWRF17LBS27194",
    "ams_barcode": "WDWDWD0015",
    "po_number": "P.O-60, Dt.-10.10.2018",
    "po_date": null,
    "invoice_date": null,
    "purchase_value": 20400.0,
    "current_status": "Working",
    "remarks": null,
    "supplier_name": "M/s. Bhupindra Trading Company"
  },
  {
    "asset_type": "OFFICE",
    "name": "Binocular",
    "quantity": 2,
    "branch_id": 1,
    "location": "J Hills",
    "serial_number": 9126796,
    "ams_barcode": "BNNKNB0001",
    "po_number": "P.O.-95, Dt.-19.03.2018",
    "po_date": null,
    "invoice_date": null,
    "purchase_value": 22900.0,
    "current_status": "Working",
    "remarks": "One at sub center",
    "supplier_name": "M/s. Altaf H Vali"
  },
  {
    "asset_type": "OFFICE",
    "name": "Samsung Fridge",
    "quantity": 1,
    "branch_id": 1,
    "location": "J Hills",
    "serial_number": "02284ZAL604470Y",
    "ams_barcode": "ElRGSR0001",
    "po_number": null,
    "po_date": null,
    "invoice_date": null,
    "purchase_value": 8400.0,
    "current_status": "Working",
    "remarks": null,
    "supplier_name": "M/s. RK Electronics"
  },
  {
    "asset_type": "OFFICE",
    "name": "Induction coocker Phillips",
    "quantity": 3,
    "branch_id": 1,
    "location": "J Hills",
    "serial_number": "ZK1A2220740497",
    "ams_barcode": "IHPHPI0003",
    "po_number": "GEMC-511687728279368,\nDt.- 07.27.2022",
    "po_date": null,
    "invoice_date": null,
    "purchase_value": 3540.61,
    "current_status": "Working",
    "remarks": null,
    "supplier_name": "M/s. Front Traders"
  },
  {
    "asset_type": "OFFICE",
    "name": "Hand drayer",
    "quantity": 4,
    "branch_id": 1,
    "location": "Image",
    "serial_number": null,
    "ams_barcode": "HDHDHD0001\nHDHDHD0002\nHDHDHD0003\nHDHDHD0004",
    "po_number": "GEMC-511687761056910,\nDt.- 05.06.2023",
    "po_date": null,
    "invoice_date": null,
    "purchase_value": 18000.0,
    "current_status": "Working",
    "remarks": null,
    "supplier_name": "Maheswari Technologies"
  },
  {
    "asset_type": "OFFICE",
    "name": "LT panel",
    "quantity": 1,
    "branch_id": 1,
    "location": "Image 2nd Floor",
    "serial_number": "TPH/2017-18 /15",
    "ams_barcode": "EIEIEI0023",
    "po_number": "STPH/PRJ-012/2013-\n2014/5626",
    "po_date": null,
    "invoice_date": null,
    "purchase_value": 230161.02,
    "current_status": "Working",
    "remarks": null,
    "supplier_name": "M/s TSIIC,"
  },
  {
    "asset_type": "OFFICE",
    "name": "Vacume cleaner Ureka frobes",
    "quantity": 1,
    "branch_id": 1,
    "location": "Image 2nd Floor",
    "serial_number": 1113608064018960,
    "ams_barcode": "FXOEVC0011",
    "po_number": "P O- 35 Dt 19.09.2016",
    "po_date": null,
    "invoice_date": null,
    "purchase_value": 13990.0,
    "current_status": "Not Working",
    "remarks": "Obsolute /exchange given to Balaji eneterprices to be delete from assets",
    "supplier_name": "Ureka Forbes Ltd"
  },
  {
    "asset_type": "OFFICE",
    "name": "water Despanser  Usha",
    "quantity": 2,
    "branch_id": 1,
    "location": "Image 2nd Floor",
    "serial_number": "17LHNCV2FS22271",
    "ams_barcode": "WDWDWD0013",
    "po_number": "P.O-67, Dt.-29.12.2017",
    "po_date": null,
    "invoice_date": null,
    "purchase_value": 20946.0,
    "current_status": "Working",
    "remarks": null,
    "supplier_name": "M/s. IT Cartridge"
  },
  {
    "asset_type": "OFFICE",
    "name": "Water Dispenser  Voltas",
    "quantity": 1,
    "branch_id": 1,
    "location": "cyber Towers",
    "serial_number": "6210164A16D001144",
    "ams_barcode": "WDWDWD0022",
    "po_number": "P O 28 Dt 14.07.2017",
    "po_date": null,
    "invoice_date": null,
    "purchase_value": 9790.0,
    "current_status": "Working",
    "remarks": null,
    "supplier_name": "Gagan Eneter prises"
  },
  {
    "asset_type": "OFFICE",
    "name": "Hand Sanitizer Panel",
    "quantity": 1,
    "branch_id": 1,
    "location": "cyber Towers",
    "serial_number": null,
    "ams_barcode": "SGSGsg0042",
    "po_number": "P.O-25, Dt- 25.08.2020",
    "po_date": null,
    "invoice_date": null,
    "purchase_value": 9832.0,
    "current_status": "Working",
    "remarks": null,
    "supplier_name": "M/s. Euronics Industries pvt ltd"
  },
  {
    "asset_type": "OFFICE",
    "name": "Wall Mounting Fans",
    "quantity": 9,
    "branch_id": 1,
    "location": "cyber Towers",
    "serial_number": null,
    "ams_barcode": "FFFFWF0033\nFFFFWF0034\nFFFFWF0035\nFFFFWF0037\nFFFFWF0038\nFFFFWF0039 FFFFWF0040 FFFFWF0041\nFFFFWF0042",
    "po_number": "P.O-45, Dt- 29.09.2009",
    "po_date": null,
    "invoice_date": null,
    "purchase_value": 11360.0,
    "current_status": "Working",
    "remarks": null,
    "supplier_name": "Prem Electricals"
  },
  {
    "asset_type": "OFFICE",
    "name": "Wall Mounting Fans",
    "quantity": 2,
    "branch_id": 1,
    "location": "cyber Towers",
    "serial_number": null,
    "ams_barcode": "FFFFWF0074\nFFFFWF0075",
    "po_number": "2020-21",
    "po_date": null,
    "invoice_date": null,
    "purchase_value": 3305.0,
    "current_status": "Working",
    "remarks": null,
    "supplier_name": "Purbji Marketing"
  },
  {
    "asset_type": "OFFICE",
    "name": "Wall Mounting Fans",
    "quantity": 3,
    "branch_id": 1,
    "location": null,
    "serial_number": null,
    "ams_barcode": "FNWFHF0002",
    "po_number": null,
    "po_date": null,
    "invoice_date": null,
    "purchase_value": 1694.92,
    "current_status": "Working",
    "remarks": null,
    "supplier_name": null
  },
  {
    "asset_type": "OFFICE",
    "name": "Cordless Phone",
    "quantity": 1,
    "branch_id": 1,
    "location": "cyber Towers",
    "serial_number": null,
    "ams_barcode": "PHOECP0008",
    "po_number": "PO 06 Dt 13.04.2017",
    "po_date": null,
    "invoice_date": null,
    "purchase_value": 5841.0,
    "current_status": "Working",
    "remarks": null,
    "supplier_name": "Prenex Systems"
  },
  {
    "asset_type": "OFFICE",
    "name": "Vaccum Cleaner",
    "quantity": 1,
    "branch_id": 1,
    "location": "cyber Towers",
    "serial_number": "1113604733001863",
    "ams_barcode": "VCVCVC0001",
    "po_number": "GEM-511687755763783\nDt.- 05.05.2023",
    "po_date": null,
    "invoice_date": null,
    "purchase_value": 19999.0,
    "current_status": "Working",
    "remarks": null,
    "supplier_name": "MAHESHWARI TECHNOLOGIES"
  },
  {
    "asset_type": "OFFICE",
    "name": "Exhaust Fan",
    "quantity": 1,
    "branch_id": 1,
    "location": "cyber Towers",
    "serial_number": null,
    "ams_barcode": "FFFFEF0008",
    "po_number": "GEM-511687721920429\nDt.- 29.12.2022",
    "po_date": null,
    "invoice_date": null,
    "purchase_value": 1389.83,
    "current_status": "Working",
    "remarks": null,
    "supplier_name": "Surya Home applience"
  },
  {
    "asset_type": "OFFICE",
    "name": "Camera - Nickon P610",
    "quantity": 1,
    "branch_id": 1,
    "location": "cyber Towers",
    "serial_number": 10006339,
    "ams_barcode": "CMCMCM0006",
    "po_number": "P.O-012,  Dt.-06-30-2015",
    "po_date": null,
    "invoice_date": null,
    "purchase_value": 20000.0,
    "current_status": "Working",
    "remarks": null,
    "supplier_name": null
  },
  {
    "asset_type": "OFFICE",
    "name": "Samsung Galaxy S 7 Tab",
    "quantity": 1,
    "branch_id": 1,
    "location": "cyber Towers",
    "serial_number": 350350150761585,
    "ams_barcode": "SGSGsg0001",
    "po_number": "P.O.-50, Dt.-2021-22",
    "po_date": null,
    "invoice_date": null,
    "purchase_value": 43050.84,
    "current_status": "Working",
    "remarks": null,
    "supplier_name": "M/s. SVS Technologies"
  },
  {
    "asset_type": "OFFICE",
    "name": "Samsung Galaxy S21",
    "quantity": 1,
    "branch_id": 1,
    "location": "cyber Towers",
    "serial_number": "R5CRAILAMSM",
    "ams_barcode": "SGGSGS0001",
    "po_number": "P.O.-42, Dt.-2021-22",
    "po_date": null,
    "invoice_date": null,
    "purchase_value": 57999.0,
    "current_status": "Working",
    "remarks": "Not in use",
    "supplier_name": "M/s. Bajaj Electronics"
  },
  {
    "asset_type": "OFFICE",
    "name": "Samsung galaxy ultra S24 mobile",
    "quantity": 1,
    "branch_id": 1,
    "location": "cyber Towers",
    "serial_number": null,
    "ams_barcode": "MBSMSG0002",
    "po_number": "117",
    "po_date": null,
    "invoice_date": null,
    "purchase_value": 119643.22,
    "current_status": "Working",
    "remarks": null,
    "supplier_name": "SVS Technologies"
  },
  {
    "asset_type": "OFFICE",
    "name": "Google Pixel Mobile",
    "quantity": 1,
    "branch_id": 1,
    "location": "cyber Towers",
    "serial_number": 358035083429864,
    "ams_barcode": "CPCHGL0001",
    "po_number": "P.O-92, Dt-19.03.2018",
    "po_date": null,
    "invoice_date": null,
    "purchase_value": 68000.0,
    "current_status": "Working",
    "remarks": "Not in Use",
    "supplier_name": "M/s. Bajaj Electronics"
  },
  {
    "asset_type": "OFFICE",
    "name": "Fridge Godrej",
    "quantity": 1,
    "branch_id": 1,
    "location": "cyber Towers",
    "serial_number": "SD01897",
    "ams_barcode": "GRGRGR0001",
    "po_number": "GEM-511687785170779,\nDt.-22.07.2022",
    "po_date": null,
    "invoice_date": null,
    "purchase_value": 24800.0,
    "current_status": "Working",
    "remarks": null,
    "supplier_name": "M/s. Singh Enterprises"
  },
  {
    "asset_type": "OFFICE",
    "name": "Paper Shredder",
    "quantity": 1,
    "branch_id": 1,
    "location": "cyber Towers",
    "serial_number": "0/14/2007-08",
    "ams_barcode": "OEPSPS0002",
    "po_number": "P.O-13, Dt.-10.05.2007",
    "po_date": null,
    "invoice_date": null,
    "purchase_value": 25313.0,
    "current_status": "Working",
    "remarks": null,
    "supplier_name": "M/s. Avanthi Business machunes limited"
  },
  {
    "asset_type": "OFFICE",
    "name": "Mini Paper Shredder",
    "quantity": 1,
    "branch_id": 1,
    "location": "cyber Towers",
    "serial_number": "AMIE/201705034",
    "ams_barcode": "OEPSTS0001",
    "po_number": "P.O-96, Dt.-26.03.2018",
    "po_date": null,
    "invoice_date": null,
    "purchase_value": 11210.0,
    "current_status": "Working",
    "remarks": null,
    "supplier_name": "M/s. Tumbi Furnitures"
  },
  {
    "asset_type": "OFFICE",
    "name": "Paper Shredding machine",
    "quantity": 1,
    "branch_id": 1,
    "location": "J. Hills",
    "serial_number": "AVANTI HS 404(E)",
    "ams_barcode": "pssmAH0001",
    "po_number": "Po No.68  dt: 03-02-2021",
    "po_date": "2021-02-03",
    "invoice_date": null,
    "purchase_value": 154237.0,
    "current_status": "Working",
    "remarks": null,
    "supplier_name": "ADITYA CORPORATION"
  },
  {
    "asset_type": "OFFICE",
    "name": "Maruti Ciaz Zeta SHVS\nPetrol MT",
    "quantity": 1,
    "branch_id": 1,
    "location": "cyber Towers",
    "serial_number": "K15BN 9221747",
    "ams_barcode": "MSMCMC0001",
    "po_number": "GEMC-511687742774425, Dt 20-Dec-2021",
    "po_date": null,
    "invoice_date": null,
    "purchase_value": 866689.79,
    "current_status": "Working",
    "remarks": null,
    "supplier_name": "MARUTI SUZUKI INDIA LIMITED"
  },
  {
    "asset_type": "OFFICE",
    "name": "DSLR Camera",
    "quantity": 1,
    "branch_id": 1,
    "location": "cyber Towers",
    "serial_number": 5704172,
    "ams_barcode": "CMscsc0001",
    "po_number": "PURCHASE ORDER (G) No.79,\nDate: 26.11.2024",
    "po_date": null,
    "invoice_date": null,
    "purchase_value": 83400.0,
    "current_status": "Working",
    "remarks": "Addition",
    "supplier_name": "M/s. V.G Chimalgi"
  },
  {
    "asset_type": "OFFICE",
    "name": "Telephone -penasonic",
    "quantity": 1,
    "branch_id": 1,
    "location": "cyber Towers",
    "serial_number": "KXTG350, KUPTG341",
    "ams_barcode": "PHOEPP0005\nPHOEPP0006",
    "po_number": "STPH/PURCHASE/2024-\n25/DEC/PG/90/7484",
    "po_date": null,
    "invoice_date": null,
    "purchase_value": 20001.0,
    "current_status": "Working",
    "remarks": "Addition",
    "supplier_name": "M/s Techno Trade Agencies"
  },
  {
    "asset_type": "OFFICE",
    "name": "LED TV- Sony",
    "quantity": 1,
    "branch_id": 1,
    "location": "cyber Towers",
    "serial_number": 7059861,
    "ams_barcode": "TVSTST0001",
    "po_number": "PURCHASE ORDER (G) No. 109,\nDate: 14.02.2025",
    "po_date": null,
    "invoice_date": null,
    "purchase_value": 81150.0,
    "current_status": "Working",
    "remarks": "Addition",
    "supplier_name": "M/S PSR IT Services Pvt. LTD"
  },
  {
    "asset_type": "OFFICE",
    "name": "GODREJ SAFETY LOCKER",
    "quantity": 1,
    "branch_id": 1,
    "location": "cyber Towers",
    "serial_number": null,
    "ams_barcode": "ALGCGG0001",
    "po_number": "PO No. 63, Dt : 25.01.2021",
    "po_date": null,
    "invoice_date": null,
    "purchase_value": 19702.0,
    "current_status": "Working",
    "remarks": "Addition",
    "supplier_name": "M/s Srinivasa Marketing"
  },
  {
    "asset_type": "FURNITURE",
    "name": "Wooden Table",
    "quantity": 1,
    "branch_id": 1,
    "location": "J Hills",
    "serial_number": null,
    "ams_barcode": "FXFFFT0171",
    "po_number": null,
    "po_date": null,
    "invoice_date": null,
    "purchase_value": 4585.42,
    "current_status": "Working",
    "remarks": null,
    "supplier_name": "Kendriya bandar"
  },
  {
    "asset_type": "FURNITURE",
    "name": "Work Staion",
    "quantity": 11,
    "branch_id": 1,
    "location": "J Hills",
    "serial_number": null,
    "ams_barcode": "FXOEWS0032 \nto\nFXOEWS0042",
    "po_number": "19.12.2001",
    "po_date": null,
    "invoice_date": null,
    "purchase_value": 37950.0,
    "current_status": "Working",
    "remarks": null,
    "supplier_name": "Infosys Technologies ltd"
  },
  {
    "asset_type": "FURNITURE",
    "name": "Godrej Almar",
    "quantity": 3,
    "branch_id": 1,
    "location": "J Hills",
    "serial_number": null,
    "ams_barcode": "FXFFFT0073\nFXFFFT0074\nFXFFFT0075",
    "po_number": "26.01.1993, 04.08.1993",
    "po_date": null,
    "invoice_date": null,
    "purchase_value": 17815.37,
    "current_status": "Working",
    "remarks": null,
    "supplier_name": "Kendriya bandar"
  },
  {
    "asset_type": "FURNITURE",
    "name": "Pedastal Draw",
    "quantity": 35,
    "branch_id": 1,
    "location": "J Hills",
    "serial_number": null,
    "ams_barcode": "DUPTPT0038\nto\nDUPTPT0064",
    "po_number": "31.03.1997",
    "po_date": null,
    "invoice_date": null,
    "purchase_value": 178255.0,
    "current_status": "Working",
    "remarks": null,
    "supplier_name": "Kendriya bandar"
  },
  {
    "asset_type": "FURNITURE",
    "name": "File Rack",
    "quantity": 4,
    "branch_id": 1,
    "location": "J Hills",
    "serial_number": null,
    "ams_barcode": "FXFFFT0225\nto\nFXFFFT0229",
    "po_number": "PO 64,Dt  14.11.2019",
    "po_date": null,
    "invoice_date": null,
    "purchase_value": 16920.0,
    "current_status": "Working",
    "remarks": null,
    "supplier_name": "Kendriya bandar"
  },
  {
    "asset_type": "FURNITURE",
    "name": "File Rack",
    "quantity": 4,
    "branch_id": 1,
    "location": "J Hills",
    "serial_number": null,
    "ams_barcode": "FXFFFT0093",
    "po_number": "PO 55,Dt 10.03.2016",
    "po_date": null,
    "invoice_date": null,
    "purchase_value": 9760.0,
    "current_status": "Working",
    "remarks": null,
    "supplier_name": "Kendriya bandar"
  },
  {
    "asset_type": "FURNITURE",
    "name": "Godrej Glass Rack",
    "quantity": 1,
    "branch_id": 1,
    "location": "J Hills",
    "serial_number": null,
    "ams_barcode": "FXFFFT0092",
    "po_number": "10.04.1991",
    "po_date": null,
    "invoice_date": null,
    "purchase_value": 5558.28,
    "current_status": "Working",
    "remarks": null,
    "supplier_name": "Kendriya bandar"
  },
  {
    "asset_type": "FURNITURE",
    "name": "Filling cabinets",
    "quantity": 2,
    "branch_id": 1,
    "location": "J Hills",
    "serial_number": null,
    "ams_barcode": "FXFFFT0232\n FXFFFT0233",
    "po_number": null,
    "po_date": null,
    "invoice_date": null,
    "purchase_value": 9057.78,
    "current_status": "Working",
    "remarks": null,
    "supplier_name": "Kendriya bandar"
  },
  {
    "asset_type": "FURNITURE",
    "name": "Filling cabinets",
    "quantity": 1,
    "branch_id": 1,
    "location": "J Hills",
    "serial_number": null,
    "ams_barcode": "FXFFFT0234",
    "po_number": null,
    "po_date": null,
    "invoice_date": null,
    "purchase_value": 7203.49,
    "current_status": "Working",
    "remarks": null,
    "supplier_name": "Kendriya bandar"
  },
  {
    "asset_type": "FURNITURE",
    "name": "Computer Table",
    "quantity": 2,
    "branch_id": 1,
    "location": "J Hills",
    "serial_number": null,
    "ams_barcode": "FXFFFT0122\nFXFFFT0123",
    "po_number": "17.05.1993",
    "po_date": null,
    "invoice_date": null,
    "purchase_value": 3542.0,
    "current_status": "Working",
    "remarks": null,
    "supplier_name": "GKS agencies"
  },
  {
    "asset_type": "FURNITURE",
    "name": "Godrej Glass Rack",
    "quantity": 1,
    "branch_id": 1,
    "location": "J Hills",
    "serial_number": null,
    "ams_barcode": "RRFFRK0011",
    "po_number": "01.01.1993",
    "po_date": null,
    "invoice_date": null,
    "purchase_value": 6441.09,
    "current_status": "Working",
    "remarks": null,
    "supplier_name": "Kendriya bandar"
  },
  {
    "asset_type": "FURNITURE",
    "name": "Wooden Table",
    "quantity": 1,
    "branch_id": 1,
    "location": "J Hills",
    "serial_number": null,
    "ams_barcode": "TETETE0011",
    "po_number": null,
    "po_date": null,
    "invoice_date": null,
    "purchase_value": 4585.42,
    "current_status": "Working",
    "remarks": null,
    "supplier_name": "Kendriya bandar"
  },
  {
    "asset_type": "FURNITURE",
    "name": "Wooden Table",
    "quantity": 2,
    "branch_id": 1,
    "location": "J Hills",
    "serial_number": null,
    "ams_barcode": "FXFFFT0101\nFXFFFT0102",
    "po_number": null,
    "po_date": null,
    "invoice_date": null,
    "purchase_value": 9170.84,
    "current_status": "Working",
    "remarks": null,
    "supplier_name": "Kendriya bandar"
  },
  {
    "asset_type": "FURNITURE",
    "name": "Godrej file Rack",
    "quantity": 2,
    "branch_id": 1,
    "location": "J Hills",
    "serial_number": null,
    "ams_barcode": "SRSRSR0001",
    "po_number": "PO 94 Dt 29.01.2010",
    "po_date": null,
    "invoice_date": null,
    "purchase_value": 31694.0,
    "current_status": "Working",
    "remarks": null,
    "supplier_name": "Kendriya bandar"
  },
  {
    "asset_type": "FURNITURE",
    "name": "Godrej Glass Rack",
    "quantity": 1,
    "branch_id": 1,
    "location": "J Hills",
    "serial_number": null,
    "ams_barcode": "RRFFRK0012",
    "po_number": "27.01.1993",
    "po_date": null,
    "invoice_date": null,
    "purchase_value": 5302.71,
    "current_status": "Working",
    "remarks": null,
    "supplier_name": "Kendriya bandar"
  },
  {
    "asset_type": "FURNITURE",
    "name": "Wooden Table",
    "quantity": 2,
    "branch_id": 1,
    "location": "J Hills",
    "serial_number": null,
    "ams_barcode": "FXFFFT0137\nFXFFFT0138",
    "po_number": "03-30-1995",
    "po_date": null,
    "invoice_date": null,
    "purchase_value": 7600.0,
    "current_status": "Working",
    "remarks": null,
    "supplier_name": "Rangoli interiors pvt ltd"
  },
  {
    "asset_type": "FURNITURE",
    "name": "Godrej Almar",
    "quantity": 1,
    "branch_id": 1,
    "location": "J Hills",
    "serial_number": null,
    "ams_barcode": "FXFFFT0068",
    "po_number": "3.10.1991",
    "po_date": null,
    "invoice_date": null,
    "purchase_value": 3536.51,
    "current_status": "Working",
    "remarks": null,
    "supplier_name": null
  },
  {
    "asset_type": "FURNITURE",
    "name": "Godrej Glass Rack",
    "quantity": 1,
    "branch_id": 1,
    "location": "J Hills",
    "serial_number": null,
    "ams_barcode": "FXFFFT0094",
    "po_number": "21.03.1996",
    "po_date": null,
    "invoice_date": null,
    "purchase_value": 6401.0,
    "current_status": "Working",
    "remarks": null,
    "supplier_name": null
  },
  {
    "asset_type": "FURNITURE",
    "name": "Datacom racks",
    "quantity": 1,
    "branch_id": 1,
    "location": "J Hills",
    "serial_number": null,
    "ams_barcode": "FXFFFT0008",
    "po_number": "12-09-1996,",
    "po_date": "1996-09-12",
    "invoice_date": null,
    "purchase_value": 45692.0,
    "current_status": "Working",
    "remarks": null,
    "supplier_name": null
  },
  {
    "asset_type": "FURNITURE",
    "name": "Datacom racks",
    "quantity": 1,
    "branch_id": 1,
    "location": "J Hills",
    "serial_number": null,
    "ams_barcode": "FXFFFT0009",
    "po_number": "12-09-1996,",
    "po_date": "1996-09-12",
    "invoice_date": null,
    "purchase_value": 45692.0,
    "current_status": "Working",
    "remarks": null,
    "supplier_name": null
  },
  {
    "asset_type": "FURNITURE",
    "name": "Datacom racks",
    "quantity": 1,
    "branch_id": 1,
    "location": "J Hills",
    "serial_number": null,
    "ams_barcode": "FXFFFT0036",
    "po_number": "104, 23.10.2000",
    "po_date": null,
    "invoice_date": null,
    "purchase_value": 29466.0,
    "current_status": "Working",
    "remarks": null,
    "supplier_name": null
  },
  {
    "asset_type": "FURNITURE",
    "name": "Datacom racks",
    "quantity": 1,
    "branch_id": 1,
    "location": "J Hills",
    "serial_number": null,
    "ams_barcode": "FXFFFT0037",
    "po_number": "104, 23.10.2000",
    "po_date": null,
    "invoice_date": null,
    "purchase_value": 29466.0,
    "current_status": "Working",
    "remarks": null,
    "supplier_name": null
  },
  {
    "asset_type": "FURNITURE",
    "name": "Datacom racks",
    "quantity": 1,
    "branch_id": 1,
    "location": "J Hills",
    "serial_number": null,
    "ams_barcode": "DRDRDR0007",
    "po_number": "82, 09.10.2007",
    "po_date": null,
    "invoice_date": null,
    "purchase_value": 32760.0,
    "current_status": "Working",
    "remarks": null,
    "supplier_name": null
  },
  {
    "asset_type": "FURNITURE",
    "name": "Datacom racks",
    "quantity": 1,
    "branch_id": 1,
    "location": "J Hills",
    "serial_number": null,
    "ams_barcode": "FXFFFT0038",
    "po_number": "82, 09.10.2007",
    "po_date": null,
    "invoice_date": null,
    "purchase_value": 32760.0,
    "current_status": "Working",
    "remarks": null,
    "supplier_name": null
  },
  {
    "asset_type": "FURNITURE",
    "name": "Datacom racks",
    "quantity": 1,
    "branch_id": 1,
    "location": "J Hills",
    "serial_number": null,
    "ams_barcode": "DRDRDR0010",
    "po_number": "39, 23.12.2015",
    "po_date": null,
    "invoice_date": null,
    "purchase_value": 38500.0,
    "current_status": "Working",
    "remarks": null,
    "supplier_name": null
  },
  {
    "asset_type": "FURNITURE",
    "name": "Open record  file Rack",
    "quantity": 33,
    "branch_id": 1,
    "location": "J Hills",
    "serial_number": null,
    "ams_barcode": "RRFFRK0019\nto\nRRFFRK0023",
    "po_number": "PO 55,64, 3.10.2016,14.11.2019",
    "po_date": null,
    "invoice_date": null,
    "purchase_value": 29120.0,
